hvac payback calculator,USD,50,0%,∞,Low,14,,,,,,,,,,,,,,,,,,,
hvac pipe size calculation,USD,50,-100%,-100%,Unknown,,,,,,,,,,,,,,,,,,,,
hvac pipe sizing,USD,50,0%,0%,Low,13,,,,,,,,,,,,,,,,,,,
hvac plenum size calculator,USD,50,∞,0%,Low,16,,,,,,,,,,,,,,,,,,,
hvac power consumption calculation,USD,50,-100%,-100%,Unknown,,,,,,,,,,,,,,,,,,,,
hvac register size calculator,USD,50,0%,∞,Low,12,,,,,,,,,,,,,,,,,,,
hvac return air calculations,USD,50,-100%,0%,Unknown,,,,,,,,,,,,,,,,,,,,
hvac return size calculator,USD,50,0%,0%,Low,4,,,,,,,,,,,,,,,,,,,
hvac room calculator,USD,50,0%,0%,High,76,0.36,3.15,,,,,,,,,,,,,,,,,
hvac room cfm calculation,USD,50,0%,0%,Low,14,,,,,,,,,,,,,,,,,,,
hvac room load calculator,USD,50,0%,0%,Medium,43,,,,,,,,,,,,,,,,,,,
hvac room size calculator,USD,50,0%,0%,Medium,36,0.71,3.20,,,,,,,,,,,,,,,,,
hvac seer rating calculator,USD,50,0%,0%,Low,13,2.79,7.43,,,,,,,,,,,,,,,,,
hvac size calculator free,USD,50,0%,0%,Medium,64,0.56,2.95,,,,,,,,,,,,,,,,,
hvac size for square footage,USD,50,0%,0%,Low,29,,,,,,,,,,,,,,,,,,,
hvac sizing calculator online free,USD,50,-100%,-100%,Unknown,,,,,,,,,,,,,,,,,,,,
hvac square footage per ton,USD,500,0%,0%,Low,26,0.53,3.94,,,,,,,,,,,,,,,,,
hvac subcooling calculator,USD,50,0%,0%,Low,0,,,,,,,,,,,,,,,,,,,
hvac subcooling formula,USD,50,0%,0%,Low,0,,,,,,,,,,,,,,,,,,,
hvac system load calculation,USD,500,0%,900%,Low,11,3.20,5.89,,,,,,,,,,,,,,,,,
hvac ton per sq ft calculator,USD,50,0%,0%,Medium,62,,,,,,,,,,,,,,,,,,,
hvac ton to btu conversion,USD,50,0%,0%,Low,18,,,,,,,,,,,,,,,,,,,
hvac ton to square footage,USD,50,0%,0%,Low,6,,,,,,,,,,,,,,,,,,,
hvac tonnage calculation formula,USD,50,0%,0%,Medium,56,1.14,9.13,,,,,,,,,,,,,,,,,
hvac trunk line calculator,USD,50,0%,0%,Low,10,,,,,,,,,,,,,,,,,,,
hvac unit conversion,USD,50,0%,0%,Medium,48,14.59,23.14,,,,,,,,,,,,,,,,,
hvac vent size calculator,USD,50,0%,0%,Low,17,,,,,,,,,,,,,,,,,,,
hvac ventilation calculation,USD,50,0%,0%,Low,6,,,,,,,,,,,,,,,,,,,
hvaccharts com,USD,50,-100%,-100%,Unknown,,,,,,,,,,,,,,,,,,,,
industrial hvac load calculation,USD,50,-100%,-100%,Unknown,,,,,,,,,,,,,,,,,,,,
latent heat equation hvac,USD,50,0%,0%,Low,6,,,,,,,,,,,,,,,,,,,
latent heat formula hvac,USD,50,0%,0%,Low,0,,,,,,,,,,,,,,,,,,,
manual duct sizing calculation,USD,50,-100%,-100%,Unknown,,,,,,,,,,,,,,,,,,,,
manual heat load calculation,USD,50,0%,0%,Medium,36,,,,,,,,,,,,,,,,,,,
manual j analysis,USD,50,0%,0%,Medium,36,,,,,,,,,,,,,,,,,,,
manual j calc,USD,500,0%,0%,Medium,48,0.81,4.97,,,,,,,,,,,,,,,,,
manual j calculation formula,USD,50,0%,0%,Low,19,0.85,3.66,,,,,,,,,,,,,,,,,
manual j heat load,USD,50,0%,0%,Medium,65,1.07,6.61,,,,,,,,,,,,,,,,,
manual j heat load calculation free,USD,50,0%,0%,High,81,1.49,10.52,,,,,,,,,,,,,,,,,
manual j heat loss calculation,USD,50,0%,0%,Medium,60,1.10,5.28,,,,,,,,,,,,,,,,,
manual j heating and cooling load calculation,USD,50,0%,0%,High,69,1.39,4.45,,,,,,,,,,,,,,,,,
manual j hvac calculator,USD,50,0%,0%,Medium,44,0.91,6.13,,,,,,,,,,,,,,,,,
manual j load calc,USD,500,0%,0%,Medium,37,0.99,5.46,,,,,,,,,,,,,,,,,
manual j load calculation online,USD,50,0%,0%,Medium,63,1.01,4.06,,,,,,,,,,,,,,,,,
manual j sizing,USD,50,0%,0%,Medium,57,1.15,4.10,,,,,,,,,,,,,,,,,
mcquay duct calculator,USD,50,-100%,-100%,Unknown,,,,,,,,,,,,,,,,,,,,
mcquay duct size calculator free download,USD,50,0%,-100%,Unknown,,,,,,,,,,,,,,,,,,,,
mcquay duct sizer download free,USD,50,0%,-100%,Unknown,,,,,,,,,,,,,,,,,,,,
mcquay duct sizer for mobile,USD,50,-100%,0%,Unknown,,,,,,,,,,,,,,,,,,,,
mcquay duct sizer online,USD,50,0%,-100%,Unknown,,,,,,,,,,,,,,,,,,,,
mcquay pipe sizer online,USD,50,0%,0%,Unknown,,,,,,,,,,,,,,,,,,,,
measuring air conditioner size,USD,50,∞,0%,Low,22,,,,,,,,,,,,,,,,,,,
ocean hvac ductulator,USD,50,0%,0%,Low,12,1.99,9.32,,,,,,,,,,,,,,,,,
online air conditioning calculator,USD,50,0%,900%,Low,5,,,,,,,,,,,,,,,,,,,
online ductulator free download,USD,50,0%,-100%,Unknown,,,,,,,,,,,,,,,,,,,,
online heat load calculation,USD,50,0%,0%,Medium,42,1.26,4.82,,,,,,,,,,,,,,,,,
online heat load calculation for air conditioning,USD,50,0%,∞,Medium,43,,,,,,,,,,,,,,,,,,,
online hvac duct size calculator,USD,50,0%,0%,Low,25,,,,,,,,,,,,,,,,,,,
online mcquay duct sizer,USD,50,-100%,0%,Unknown,,,,,,,,,,,,,,,,,,,,
pipe sizer mcquay,USD,50,0%,0%,Low,8,,,,,,,,,,,,,,,,,,,
plenum box area calculation formula,USD,50,0%,-100%,Unknown,,,,,,,,,,,,,,,,,,,,
plenum box sizing calculation smacna,USD,50,∞,0%,Low,0,,,,,,,,,,,,,,,,,,,
plenum size calculator,USD,50,0%,0%,Low,7,,,,,,,,,,,,,,,,,,,
pressure drop calculator air duct,USD,50,0%,0%,Low,2,,,,,,,,,,,,,,,,,,,
properly sizing ductwork,USD,50,0%,0%,Medium,43,,,,,,,,,,,,,,,,,,,
pump head calculation in hvac,USD,50,0%,-100%,Unknown,,,,,,,,,,,,,,,,,,,,
quick heat load calculation,USD,50,0%,0%,Medium,48,0.84,3.71,,,,,,,,,,,,,,,,,
quick manual j calculation,USD,50,0%,0%,Medium,66,0.91,21.94,,,,,,,,,,,,,,,,,
rectangular duct area calculation,USD,50,0%,0%,Low,10,,,,,,,,,,,,,,,,,,,
rectangular duct area calculator online,USD,0,0%,0%,Unknown,,,,,,,,,,,,,,,,,,,,
rectangular duct calculator,USD,50,0%,0%,Low,4,,,,,,,,,,,,,,,,,,,
reducer duct area calculation formula,USD,50,-100%,0%,Unknown,,,,,,,,,,,,,,,,,,,,
refrigeration heat load calculation,USD,50,0%,0%,Low,0,,,,,,,,,,,,,,,,,,,
residential ac tonnage calculator,USD,50,0%,0%,Low,23,,,,,,,,,,,,,,,,,,,
residential cooling and heating load calculations,USD,50,-100%,-100%,Unknown,,,,,,,,,,,,,,,,,,,,
residential duct calculator,USD,50,0%,0%,Low,32,,,,,,,,,,,,,,,,,,,
residential ductwork sizing,USD,50,0%,0%,Low,23,,,,,,,,,,,,,,,,,,,
residential heat loss and heat gain calculation,USD,50,0%,0%,Medium,57,,,,,,,,,,,,,,,,,,,
residential heat loss calculator,USD,50,0%,0%,Medium,41,1.06,11.50,,,,,,,,,,,,,,,,,
residential heating and cooling load calculations,USD,50,-100%,-100%,Unknown,,,,,,,,,,,,,,,,,,,,
residential heating load calculations,USD,50,0%,0%,Unknown,,,,,,,,,,,,,,,,,,,,
residential hvac cost calculator,USD,50,0%,0%,Unknown,,,,,,,,,,,,,,,,,,,,
residential hvac tonnage calculator,USD,50,0%,0%,Low,18,,,,,,,,,,,,,,,,,,,
restaurant hvac load calculation,USD,50,-100%,-100%,Unknown,,,,,,,,,,,,,,,,,,,,
return air calculation hvac,USD,50,-100%,0%,Unknown,,,,,,,,,,,,,,,,,,,,
return air duct calculator,USD,50,0%,0%,Low,7,,,,,,,,,,,,,,,,,,,
return air duct sizing calculator,USD,500,0%,0%,Low,7,0.91,6.64,,,,,,,,,,,,,,,,,
return duct calculator,USD,50,0%,0%,Low,7,,,,,,,,,,,,,,,,,,,
room ac tonnage calculator,USD,50,0%,0%,Low,29,,,,,,,,,,,,,,,,,,,
room area and ac tonnage,USD,0,0%,0%,Unknown,,,,,,,,,,,,,,,,,,,,
room heat load calculation excel,USD,50,∞,∞,Medium,43,,,,,,,,,,,,,,,,,,,
room size ac btu calculator,USD,50,0%,0%,Medium,50,,,,,,,,,,,,,,,,,,,
room size ac ton,USD,50,0%,0%,Low,12,,,,,,,,,,,,,,,,,,,
room size ac tonnage calculator,USD,50,-100%,-100%,Unknown,,,,,,,,,,,,,,,,,,,,
room size and ac btu,USD,50,0%,0%,Medium,55,0.12,0.94,,,,,,,,,,,,,,,,,
room size and ac capacity,USD,50,0%,0%,Low,12,0.04,4.16,,,,,,,,,,,,,,,,,
room size and ac tonnage calculator,USD,50,-100%,0%,Unknown,,,,,,,,,,,,,,,,,,,,
room size and air conditioner capacity,USD,50,0%,0%,Low,12,0.04,4.16,,,,,,,,,,,,,,,,,
room size for ac capacity,USD,50,-100%,0%,Unknown,,,,,,,,,,,,,,,,,,,,
room size to ac capacity,USD,50,0%,0%,Medium,34,,,,,,,,,,,,,,,,,,,
room size to ac tonnage,USD,50,0%,0%,Unknown,,,,,,,,,,,,,,,,,,,,
round duct calculator,USD,500,0%,900%,Low,3,,,,,,,,,,,,,,,,,,,
seer calculator for heat pump,USD,50,0%,0%,Low,24,1.62,8.22,,,,,,,,,,,,,,,,,
seer calculator heat pump,USD,50,0%,-100%,Unknown,,,,,,,,,,,,,,,,,,,,
seer efficiency calculator,USD,500,0%,0%,Low,4,1.88,9.26,,,,,,,,,,,,,,,,,
seer electricity calculator,USD,50,0%,-100%,Unknown,,,,,,,,,,,,,,,,,,,,
seer energy calculator,USD,50,0%,0%,Low,7,,,,,,,,,,,,,,,,,,,
seer rating efficiency calculator,USD,50,0%,0%,Low,0,,,,,,,,,,,,,,,,,,,
seer rating savings calculator,USD,5000,0%,0%,Low,1,2.09,8.21,,,,,,,,,,,,,,,,,
seer value calculator,USD,50,0%,0%,Low,0,,,,,,,,,,,,,,,,,,,
sensible heat formula hvac,USD,50,0%,0%,Low,0,,,,,,,,,,,,,,,,,,,
server room hvac calculator,USD,50,0%,0%,Medium,43,,,,,,,,,,,,,,,,,,,
shop heater calculator,USD,50,0%,0%,Low,11,,,,,,,,,,,,,,,,,,,
simple cooling load calculation,USD,50,0%,-100%,Unknown,,,,,,,,,,,,,,,,,,,,
simple hvac load calculator,USD,50,0%,0%,High,71,,,,,,,,,,,,,,,,,,,
simple manual j calculator,USD,50,0%,0%,Medium,55,0.49,3.65,,,,,,,,,,,,,,,,,
size ac for my house,USD,50,∞,0%,High,100,0.29,5.00,,,,,,,,,,,,,,,,,
size ac per square foot,USD,50,0%,0%,Medium,43,,,,,,,,,,,,,,,,,,,
size ac unit for room,USD,500,900%,0%,High,100,0.18,1.88,,,,,,,,,,,,,,,,,
size air conditioning unit calculator,USD,5000,0%,0%,Low,25,0.49,2.31,,,,,,,,,,,,,,,,,
size of ac for square footage,USD,50,0%,-90%,Medium,46,0.29,3.91,,,,,,,,,,,,,,,,,
size of ac needed for house,USD,50,0%,0%,High,86,,,,,,,,,,,,,,,,,,,
size of ac unit based on square footage,USD,50,0%,0%,Medium,65,0.33,3.23,,,,,,,,,,,,,,,,,
size of ac unit for my house,USD,50,0%,-100%,Unknown,,,,,,,,,,,,,,,,,,,,
size of ductwork,USD,500,0%,0%,Low,17,1.14,12.50,,,,,,,,,,,,,,,,,
size of hvac unit per square foot,USD,50,0%,0%,Medium,48,,,,,,,,,,,,,,,,,,,
sizing ac units square footage,USD,50,0%,-90%,Medium,46,0.29,3.91,,,,,,,,,,,,,,,,,
sizing air handler calculator,USD,50,0%,0%,Low,18,,,,,,,,,,,,,,,,,,,
sizing an ac system,USD,50,-100%,-100%,Unknown,,,,,,,,,,,,,,,,,,,,
sizing ductwork for a house,USD,50,0%,0%,Low,32,0.73,3.28,,,,,,,,,,,,,,,,,
sizing ductwork for cfm,USD,500,0%,0%,Low,8,0.83,4.89,,,,,,,,,,,,,,,,,
sizing ductwork per room,USD,50,-100%,-100%,Unknown,,,,,,,,,,,,,,,,,,,,
sizing hvac tonnage,USD,50,0%,∞,Low,0,,,,,,,,,,,,,,,,,,,
smacna duct calculator,USD,50,0%,0%,Low,23,,,,,,,,,,,,,,,,,,,
smacna duct leakage calculator,USD,50,0%,0%,Low,6,,,,,,,,,,,,,,,,,,,
smacna duct leakage test calculator,USD,50,0%,0%,Low,14,,,,,,,,,,,,,,,,,,,
smacna ductulator,USD,50,0%,0%,Medium,51,0.78,7.45,,,,,,,,,,,,,,,,,
split ac load calculation,USD,0,0%,0%,Unknown,,,,,,,,,,,,,,,,,,,,
split ac ton calculation,USD,50,0%,0%,Unknown,,,,,,,,,,,,,,,,,,,,
split cycle air conditioner size calculator,USD,0,0%,0%,Unknown,,,,,,,,,,,,,,,,,,,,
sq ft to ac ton calculator,USD,50,0%,0%,Medium,40,0.43,1.20,,,,,,,,,,,,,,,,,
square duct calculator,USD,50,0%,0%,Low,3,,,,,,,,,,,,,,,,,,,
square duct to round duct calculator,USD,50,0%,0%,Low,6,,,,,,,,,,,,,,,,,,,
square footage btu air conditioner calculator,USD,50,0%,0%,Medium,36,0.06,1.30,,,,,,,,,,,,,,,,,
square footage per ton hvac,USD,50,0%,0%,Low,13,0.80,3.21,,,,,,,,,,,,,,,,,
square footage per ton of air conditioning,USD,500,0%,-90%,Medium,33,0.34,4.35,,,,,,,,,,,,,,,,,
square footage to ac tonnage,USD,500,0%,0%,Medium,39,0.31,2.96,,,,,,,,,,,,,,,,,
static pressure calculation in duct,USD,50,0%,-100%,Unknown,,,,,,,,,,,,,,,,,,,,
static pressure formula hvac,USD,50,0%,0%,Low,2,,,,,,,,,,,,,,,,,,,
static pressure hvac formula,USD,50,0%,0%,Low,0,,,,,,,,,,,,,,,,,,,
subcool and superheat calculator,USD,500,0%,0%,Low,3,1.33,4.81,,,,,,,,,,,,,,,,,
superheat and subcool calculator,USD,500,0%,0%,Low,3,1.33,4.81,,,,,,,,,,,,,,,,,
superheat and subcooling calculator online,USD,50,0%,0%,Unknown,,,,,,,,,,,,,,,,,,,,
thermal load calculation,USD,50,0%,0%,Low,25,0.63,3.03,,,,,,,,,,,,,,,,,
ton air conditioner square footage,USD,500,0%,0%,Medium,39,0.31,2.96,,,,,,,,,,,,,,,,,
ton of air conditioning per square foot,USD,500,0%,-90%,Medium,33,0.34,4.35,,,,,,,,,,,,,,,,,
tonnage ac,USD,50,0%,-90%,Low,17,0.46,9.22,,,,,,,,,,,,,,,,,
tonnage needed for ac,USD,50,0%,0%,High,82,0.63,4.50,,,,,,,,,,,,,,,,,
tonnage of ac and room size,USD,0,0%,0%,Unknown,,,,,,,,,,,,,,,,,,,,
tonnage of ac required for room,USD,50,0%,-100%,Unknown,,,,,,,,,,,,,,,,,,,,
tonnage on ac unit,USD,50,0%,0%,Low,2,,,,,,,,,,,,,,,,,,,
tonnage per square foot ac,USD,500,0%,-90%,Medium,33,0.34,4.35,,,,,,,,,,,,,,,,,
tonnage required for ac,USD,50,0%,0%,High,82,0.63,4.50,,,,,,,,,,,,,,,,,
total cooling load formula,USD,50,0%,0%,Low,3,,,,,,,,,,,,,,,,,,,
total heat formula hvac,USD,50,0%,0%,Low,0,,,,,,,,,,,,,,,,,,,
tr formula in hvac,USD,0,0%,0%,Unknown,,,,,,,,,,,,,,,,,,,,
trane air duct calculator,USD,50,0%,0%,High,82,,,,,,,,,,,,,,,,,,,
trane duct sizer,USD,50,0%,0%,Low,14,,,,,,,,,,,,,,,,,,,
trane furnace size calculator,USD,50,0%,0%,Low,0,,,,,,,,,,,,,,,,,,,
trane trace load calculation,USD,50,0%,-100%,Unknown,,,,,,,,,,,,,,,,,,,,
treated fresh air calculation formula,USD,50,∞,0%,Low,0,,,,,,,,,,,,,,,,,,,
ventilation cooling load calculation,USD,50,-100%,-100%,Unknown,,,,,,,,,,,,,,,,,,,,
ventilation duct calculator,USD,50,-100%,-100%,Unknown,,,,,,,,,,,,,,,,,,,,
ventilation duct size calculator,USD,50,-100%,0%,Unknown,,,,,,,,,,,,,,,,,,,,
ventilation heat load calculation,USD,50,∞,0%,Low,14,,,,,,,,,,,,,,,,,,,
weight of ductwork calculator,USD,500,-90%,-90%,Low,2,,,,,,,,,,,,,,,,,,,
window ac tonnage calculator,USD,50,0%,0%,Low,0,,,,,,,,,,,,,,,,,,,
wrightsoft manual d,USD,50,0%,0%,Low,11,,,,,,,,,,,,,,,,,,,