Keyword Stats 2026-06-19 at 14_52_54,,,,,,,,,,,,,,,,,,,,,,,,,
"June 1, 2025 - May 31, 2026",,,,,,,,,,,,,,,,,,,,,,,,,
Keyword,Currency,Avg. monthly searches,Three month change,YoY change,Competition,Competition (indexed value),Top of page bid (low range),Top of page bid (high range),Ad impression share,Organic impression share,Organic average position,In account?,In plan?,Searches: Jun 2025,Searches: Jul 2025,Searches: Aug 2025,Searches: Sep 2025,Searches: Oct 2025,Searches: Nov 2025,Searches: Dec 2025,Searches: Jan 2026,Searches: Feb 2026,Searches: Mar 2026,Searches: Apr 2026,Searches: May 2026
hvac formulas,USD,500,-90%,-90%,Low,12,3.00,21.83,,,,,,,,,,,,,,,,,
hvac calculators,USD,5000,-90%,-90%,Medium,45,0.65,5.68,,,,,,,,,,,,,,,,,
furnace and ac replacement cost calculator,USD,500,900%,0%,Medium,60,2.47,10.50,,,,,,,,,,,,,,,,,
new hvac system cost calculator,USD,500,900%,900%,High,67,2.19,9.29,,,,,,,,,,,,,,,,,
ductwork replacement cost calculator,USD,5000,0%,-90%,Medium,51,2.53,10.25,,,,,,,,,,,,,,,,,
manual j calculation,USD,5000,0%,0%,Medium,49,1.04,6.85,,,,,,,,,,,,,,,,,
heat load calculation hvac,USD,500,0%,0%,Medium,53,1.19,5.72,,,,,,,,,,,,,,,,,
hvac repair cost calculator,USD,500,0%,0%,Low,14,3.09,14.16,,,,,,,,,,,,,,,,,
hvac load calculation,USD,5000,0%,0%,Low,23,1.12,5.93,,,,,,,,,,,,,,,,,
hvac sizing calculator,USD,5000,900%,900%,Low,16,0.64,3.71,,,,,,,,,,,,,,,,,
manual j,USD,5000,0%,0%,Medium,41,1.11,6.02,,,,,,,,,,,,,,,,,
manual j load calculation,USD,5000,0%,900%,Medium,60,0.95,5.55,,,,,,,,,,,,,,,,,
air conditioning installation cost calculator,USD,500,0%,0%,Low,26,2.93,13.97,,,,,,,,,,,,,,,,,
hvac tonnage calculator,USD,500,900%,900%,Low,23,0.43,3.20,,,,,,,,,,,,,,,,,
central air installation cost calculator,USD,500,0%,0%,Low,20,1.89,9.63,,,,,,,,,,,,,,,,,
free hvac duct sizing calculator,USD,500,0%,0%,Low,31,1.03,6.11,,,,,,,,,,,,,,,,,
commercial hvac cost calculator,USD,50,0%,-90%,Medium,35,2.74,13.56,,,,,,,,,,,,,,,,,
hvac financing calculator,USD,50,0%,0%,Low,19,2.64,6.52,,,,,,,,,,,,,,,,,
hvac load calculator free,USD,500,0%,0%,Medium,54,0.96,4.20,,,,,,,,,,,,,,,,,
hvac replacement cost calculator,USD,5000,0%,0%,Low,5,2.65,12.05,,,,,,,,,,,,,,,,,
hvac labor rate calculator,USD,50,0%,0%,Low,10,3.05,12.00,,,,,,,,,,,,,,,,,
wrightsoft manual j,USD,500,0%,0%,Medium,49,1.60,14.71,,,,,,,,,,,,,,,,,
heat load calculation,USD,500,0%,-90%,Medium,48,0.83,4.16,,,,,,,,,,,,,,,,,
hvac cost calculator,USD,500,0%,0%,Low,4,2.08,8.37,,,,,,,,,,,,,,,,,
duct cleaning cost calculator,USD,500,0%,0%,Medium,62,2.66,12.36,,,,,,,,,,,,,,,,,
hvac pricing calculator,USD,50,0%,0%,Medium,39,2.87,13.37,,,,,,,,,,,,,,,,,
hvac tons per square foot commercial calculator,USD,500,-90%,-90%,Low,30,1.05,6.38,,,,,,,,,,,,,,,,,
hvac maintenance cost estimating,USD,50,0%,0%,High,71,,,,,,,,,,,,,,,,,,,
free manual j calculator,USD,500,0%,0%,Medium,51,0.79,3.50,,,,,,,,,,,,,,,,,
acca manual j,USD,500,0%,0%,Medium,45,1.23,5.69,,,,,,,,,,,,,,,,,
air conditioner calculator,USD,5000,0%,0%,Low,18,0.49,2.55,,,,,,,,,,,,,,,,,
duct calculator,USD,5000,0%,0%,Low,4,0.62,5.76,,,,,,,,,,,,,,,,,
formula air hvac,USD,500,0%,0%,Low,7,5.55,18.20,,,,,,,,,,,,,,,,,
central air cost calculator,USD,50,900%,900%,Medium,59,2.18,10.25,,,,,,,,,,,,,,,,,
hvac calculation formula,USD,50,0%,0%,Low,33,0.93,6.01,,,,,,,,,,,,,,,,,
ac ton calculator,USD,500,0%,0%,Medium,44,0.54,1.78,,,,,,,,,,,,,,,,,
hvac manual j,USD,500,0%,0%,Medium,55,1.15,6.19,,,,,,,,,,,,,,,,,
air conditioning cost calculator,USD,500,900%,0%,Medium,35,2.39,10.05,,,,,,,,,,,,,,,,,
ac tonnage calculator per square foot,USD,500,0%,0%,Low,19,0.36,3.20,,,,,,,,,,,,,,,,,
air conditioning size calculator,USD,5000,0%,0%,Low,25,0.49,2.31,,,,,,,,,,,,,,,,,
hvac estimate cost,USD,50,0%,0%,Medium,48,,,,,,,,,,,,,,,,,,,
commercial hvac sizing calculator,USD,50,0%,0%,Medium,59,1.64,6.56,,,,,,,,,,,,,,,,,
commercial hvac calculator,USD,50,0%,0%,Medium,57,1.27,8.71,,,,,,,,,,,,,,,,,
ductwork cost calculator,USD,50,0%,0%,Low,33,,,,,,,,,,,,,,,,,,,
hvac system replacement cost calculator,USD,5000,0%,900%,Low,6,2.63,10.60,,,,,,,,,,,,,,,,,
hvac duct calculator,USD,5000,-90%,-90%,Low,6,0.67,5.11,,,,,,,,,,,,,,,,,
hvac loan calculator,USD,50,0%,0%,Low,13,2.61,7.01,,,,,,,,,,,,,,,,,
btu calculation formula for air conditioner,USD,500,0%,0%,Low,25,0.22,2.70,,,,,,,,,,,,,,,,,
duct size calculator,USD,5000,0%,0%,Low,7,1.00,5.97,,,,,,,,,,,,,,,,,
hvac hourly rate calculator,USD,50,0%,0%,Low,0,,,,,,,,,,,,,,,,,,,
hvac installation cost calculator,USD,500,-90%,0%,Low,3,3.94,13.53,,,,,,,,,,,,,,,,,
hvac estimate calculator,USD,50,-90%,0%,High,79,3.30,14.72,,,,,,,,,,,,,,,,,
new ac unit estimate,USD,50,0%,0%,High,70,8.09,38.26,,,,,,,,,,,,,,,,,
manual j load calculation free,USD,50,900%,900%,Medium,58,0.71,3.53,,,,,,,,,,,,,,,,,
manual j heat load calculation,USD,500,0%,0%,Medium,59,1.12,5.78,,,,,,,,,,,,,,,,,
commercial hvac load calculation free,USD,50,0%,0%,High,86,,,,,,,,,,,,,,,,,,,
new hvac system cost estimate,USD,50,0%,0%,High,82,2.57,11.02,,,,,,,,,,,,,,,,,
simple heat load calculator,USD,50,0%,0%,Medium,33,1.18,5.43,,,,,,,,,,,,,,,,,
air conditioning calculation formula,USD,50,0%,-90%,Low,19,0.36,3.20,,,,,,,,,,,,,,,,,
manual j calculation online,USD,500,0%,0%,Medium,61,1.31,10.02,,,,,,,,,,,,,,,,,
hvac system calculator,USD,500,-90%,0%,Medium,51,1.80,6.68,,,,,,,,,,,,,,,,,
online ductulator,USD,5000,0%,0%,Low,6,1.19,3.41,,,,,,,,,,,,,,,,,
central ac installation cost calculator,USD,500,0%,0%,Low,1,3.12,16.04,,,,,,,,,,,,,,,,,
hvac btu calculator,USD,500,0%,0%,Low,19,0.36,3.20,,,,,,,,,,,,,,,,,
hvac cfm calculator online,USD,50,0%,0%,Medium,43,,,,,,,,,,,,,,,,,,,
cooling load calculation,USD,500,0%,0%,Low,32,0.45,3.20,,,,,,,,,,,,,,,,,
hvac trunk size calculator,USD,50,0%,0%,Low,14,,,,,,,,,,,,,,,,,,,
central heat and air installation cost calculator,USD,50,0%,0%,Low,0,,,,,,,,,,,,,,,,,,,
manual j calculation near me,USD,50,0%,0%,High,68,2.51,14.59,,,,,,,,,,,,,,,,,
ducted air conditioning running cost calculator,USD,50,0%,-100%,Unknown,,,,,,,,,,,,,,,,,,,,
central heat and air cost calculator,USD,50,-100%,-100%,Unknown,,,,,,,,,,,,,,,,,,,,
central ac size calculator,USD,500,900%,0%,Low,30,0.37,3.65,,,,,,,,,,,,,,,,,
hvac ton calculator,USD,50,0%,0%,Low,26,0.37,3.13,,,,,,,,,,,,,,,,,
manual j residential load calculation,USD,500,0%,0%,High,99,1.08,5.04,,,,,,,,,,,,,,,,,
metal building hvac calculator,USD,50,0%,0%,Medium,40,3.83,5.31,,,,,,,,,,,,,,,,,
hvac energy savings calculator,USD,500,0%,0%,Low,14,1.79,6.26,,,,,,,,,,,,,,,,,
central air installation cost calculator with ductwork,USD,50,0%,-100%,Unknown,,,,,,,,,,,,,,,,,,,,
heat pump seer calculator,USD,50,0%,0%,Low,24,,,,,,,,,,,,,,,,,,,
hvac replacement calculator,USD,50,0%,0%,Medium,45,3.62,16.73,,,,,,,,,,,,,,,,,
estimate heating and cooling costs,USD,50,0%,0%,Medium,64,2.64,11.22,,,,,,,,,,,,,,,,,
central air conditioner size calculator,USD,500,900%,0%,Low,30,0.37,3.65,,,,,,,,,,,,,,,,,
central air replacement cost calculator,USD,50,0%,0%,Low,13,3.79,11.08,,,,,,,,,,,,,,,,,
geothermal heat pump cost calculator,USD,50,0%,0%,Low,14,,,,,,,,,,,,,,,,,,,
sizing hvac system calculations,USD,500,0%,0%,Low,20,0.73,4.90,,,,,,,,,,,,,,,,,
hvac efficiency calculator,USD,50,0%,0%,Low,13,,,,,,,,,,,,,,,,,,,
central air calculator,USD,50,0%,0%,Medium,47,0.40,2.46,,,,,,,,,,,,,,,,,
central air estimate cost,USD,50,∞,0%,Medium,64,,,,,,,,,,,,,,,,,,,
tonnage of ac unit,USD,500,0%,0%,Low,13,0.74,8.15,,,,,,,,,,,,,,,,,
sizing ac unit calculator,USD,5000,0%,0%,Low,25,0.49,2.31,,,,,,,,,,,,,,,,,
hvac calculator online,USD,50,0%,0%,Low,29,0.91,3.97,,,,,,,,,,,,,,,,,
hvac load calculation formula,USD,50,0%,0%,Low,25,1.06,4.32,,,,,,,,,,,,,,,,,
central air and heat installation cost calculator,USD,50,0%,0%,Low,0,,,,,,,,,,,,,,,,,,,
air duct calculator,USD,5000,0%,0%,Low,4,0.62,5.76,,,,,,,,,,,,,,,,,
manual d hvac,USD,500,0%,0%,High,75,1.31,13.64,,,,,,,,,,,,,,,,,
air conditioning btu calculator,USD,5000,0%,0%,Low,11,0.12,1.62,,,,,,,,,,,,,,,,,
hvac unit size calculator,USD,500,0%,0%,Low,13,0.64,3.57,,,,,,,,,,,,,,,,,
commercial ductwork cost calculator,USD,50,0%,0%,Medium,50,,,,,,,,,,,,,,,,,,,
hvac savings calculator,USD,50,0%,0%,Low,7,,,,,,,,,,,,,,,,,,,
split ac tonnage calculator,USD,50,0%,0%,Low,22,,,,,,,,,,,,,,,,,,,
ac heat load calculation,USD,50,0%,0%,Low,16,1.13,7.33,,,,,,,,,,,,,,,,,
heating and cooling calculator,USD,50,0%,0%,Low,24,0.76,3.20,,,,,,,,,,,,,,,,,
cooling load calculation hvac,USD,50,0%,0%,Medium,57,1.07,2.75,,,,,,,,,,,,,,,,,
heating and cooling cost calculator,USD,50,0%,0%,Medium,64,2.64,11.22,,,,,,,,,,,,,,,,,
hvac square footage calculator,USD,50,0%,0%,Medium,38,0.51,3.20,,,,,,,,,,,,,,,,,
ducted air conditioning size calculator,USD,50,0%,∞,Low,14,,,,,,,,,,,,,,,,,,,
new air conditioner estimate,USD,50,0%,0%,High,79,5.00,38.68,,,,,,,,,,,,,,,,,
hvac capacity calculator,USD,500,900%,900%,Low,3,0.66,3.91,,,,,,,,,,,,,,,,,
duct sizer,USD,500,0%,0%,Low,17,1.14,12.50,,,,,,,,,,,,,,,,,
new hvac cost calculator,USD,50,0%,0%,Low,19,,,,,,,,,,,,,,,,,,,
calculate tonnage hvac,USD,50,0%,0%,Medium,34,1.20,2.34,,,,,,,,,,,,,,,,,
air conditioner replacement cost calculator,USD,500,0%,900%,Low,5,2.70,7.88,,,,,,,,,,,,,,,,,
hvac price calculator,USD,500,0%,900%,High,70,2.31,12.00,,,,,,,,,,,,,,,,,
furnace repair cost calculator,USD,500,-90%,0%,Low,4,,,,,,,,,,,,,,,,,,,
heating and cooling costs per square foot calculator,USD,50,∞,0%,Low,0,,,,,,,,,,,,,,,,,,,
commercial hvac load calculation,USD,500,-90%,0%,Medium,40,2.29,8.79,,,,,,,,,,,,,,,,,
hvac j calculation,USD,50,0%,0%,Medium,51,1.16,6.56,,,,,,,,,,,,,,,,,
size of central air conditioner for square footage,USD,50,0%,0%,Medium,42,0.30,40.87,,,,,,,,,,,,,,,,,
hvac cost estimate,USD,50,0%,0%,Medium,51,3.28,15.94,,,,,,,,,,,,,,,,,
size of ac unit per square foot,USD,500,900%,0%,Medium,62,0.27,3.49,,,,,,,,,,,,,,,,,
tonnage for ac unit,USD,500,0%,0%,Low,13,0.74,8.15,,,,,,,,,,,,,,,,,
hvac size per square foot,USD,50,0%,0%,Medium,52,0.87,6.50,,,,,,,,,,,,,,,,,
hvac system design calculations,USD,50,0%,0%,High,79,,,,,,,,,,,,,,,,,,,
air conditioning load calculation,USD,5000,0%,0%,Low,23,1.12,5.93,,,,,,,,,,,,,,,,,
hvac design calculations,USD,50,0%,0%,Medium,53,3.06,6.24,,,,,,,,,,,,,,,,,
central air size calculator,USD,50,0%,0%,Medium,35,0.43,2.11,,,,,,,,,,,,,,,,,
duct sizer online,USD,50,0%,0%,Low,20,0.94,6.98,,,,,,,,,,,,,,,,,
free heat load calculator,USD,50,0%,0%,Medium,63,0.93,4.53,,,,,,,,,,,,,,,,,
hvac calc,USD,5000,-90%,-90%,Medium,45,0.65,5.68,,,,,,,,,,,,,,,,,
hvac manual j calculation free,USD,50,∞,0%,High,86,,,,,,,,,,,,,,,,,,,
hvac ductwork calculator,USD,5000,-90%,-90%,Low,6,0.67,5.11,,,,,,,,,,,,,,,,,
hvac duct size calculator,USD,500,0%,0%,Low,8,1.05,5.69,,,,,,,,,,,,,,,,,
central ac cost calculator,USD,50,0%,0%,Low,11,1.15,3.45,,,,,,,,,,,,,,,,,
hvac operating cost calculator,USD,50,0%,0%,Low,9,,,,,,,,,,,,,,,,,,,
ductwork calculator,USD,5000,0%,0%,Low,4,0.62,5.76,,,,,,,,,,,,,,,,,
commercial heat load calculation,USD,50,0%,0%,High,74,2.24,6.28,,,,,,,,,,,,,,,,,
hvac design calculations excel,USD,50,0%,0%,Low,32,,,,,,,,,,,,,,,,,,,
commercial hvac tonnage calculator,USD,50,0%,0%,Low,23,1.14,8.43,,,,,,,,,,,,,,,,,
ac seer calculator,USD,50,0%,0%,Low,13,2.79,7.43,,,,,,,,,,,,,,,,,
ducted air conditioning calculator,USD,50,0%,-100%,Unknown,,,,,,,,,,,,,,,,,,,,
hvac charge calculator,USD,50,0%,0%,Low,19,1.14,3.07,,,,,,,,,,,,,,,,,
residential hvac sizing calculator,USD,50,0%,0%,Low,29,0.73,8.31,,,,,,,,,,,,,,,,,
commercial ac calculator,USD,50,0%,0%,Medium,57,1.27,8.71,,,,,,,,,,,,,,,,,
manual j hvac residential load calculation,USD,50,0%,0%,Low,19,1.28,13.03,,,,,,,,,,,,,,,,,
hvac energy calculations,USD,50,0%,0%,High,86,,,,,,,,,,,,,,,,,,,
heating and cooling load calculation,USD,50,0%,0%,High,69,1.16,4.75,,,,,,,,,,,,,,,,,
hvac ductulator,USD,500,0%,0%,Medium,37,0.66,5.37,,,,,,,,,,,,,,,,,
cfm calculation formula in hvac,USD,500,0%,0%,Low,11,0.59,3.20,,,,,,,,,,,,,,,,,
hvac btu per square foot,USD,50,0%,0%,Medium,48,0.48,6.82,,,,,,,,,,,,,,,,,
hvac profit margin calculator,USD,50,0%,0%,Low,17,2.39,8.00,,,,,,,,,,,,,,,,,
sizing ac unit by cubic feet,USD,50,-100%,-100%,Unknown,,,,,,,,,,,,,,,,,,,,
air conditioning running cost calculator,USD,50,0%,0%,Low,9,,,,,,,,,,,,,,,,,,,
duct calculator online,USD,500,0%,0%,Low,5,1.33,6.05,,,,,,,,,,,,,,,,,
hvac load calc,USD,5000,0%,0%,Low,23,1.12,5.93,,,,,,,,,,,,,,,,,
hvac roi calculator,USD,50,0%,0%,Low,14,,,,,,,,,,,,,,,,,,,
hvac airflow calculation,USD,50,0%,0%,Low,23,,,,,,,,,,,,,,,,,,,
hvac installation calculator,USD,50,0%,0%,High,86,2.56,15.44,,,,,,,,,,,,,,,,,
residential hvac load calculation,USD,50,0%,0%,Medium,56,1.95,6.25,,,,,,,,,,,,,,,,,
air conditioner capacity calculation formula,USD,50,0%,-90%,Low,19,0.36,3.20,,,,,,,,,,,,,,,,,
online manual j,USD,50,-90%,0%,High,67,1.33,12.92,,,,,,,,,,,,,,,,,
calculate air conditioner size for house,USD,50,0%,0%,High,71,0.74,5.00,,,,,,,,,,,,,,,,,
hvac static pressure calculator,USD,50,0%,0%,Low,0,,,,,,,,,,,,,,,,,,,
air conditioning tonnage calculator,USD,5000,0%,0%,Low,20,0.57,3.20,,,,,,,,,,,,,,,,,
residential heat load calculation,USD,50,0%,0%,Medium,56,1.27,5.97,,,,,,,,,,,,,,,,,
hvac sizing calculator excel,USD,50,-100%,-100%,Unknown,,,,,,,,,,,,,,,,,,,,
hvac seer calculator,USD,50,0%,0%,Low,13,2.79,7.43,,,,,,,,,,,,,,,,,
air conditioner size per square foot,USD,500,900%,0%,Medium,62,0.27,3.49,,,,,,,,,,,,,,,,,
mcquay duct sizer,USD,500,0%,0%,Low,16,3.00,13.29,,,,,,,,,,,,,,,,,
duct load calculation hvac,USD,50,-100%,-100%,Unknown,,,,,,,,,,,,,,,,,,,,
hvac cfm calculator,USD,500,0%,0%,Low,5,0.55,3.27,,,,,,,,,,,,,,,,,
central air unit size calculator,USD,500,900%,0%,Low,30,0.37,3.65,,,,,,,,,,,,,,,,,
hvac system cost calculator,USD,500,0%,0%,Low,32,2.07,9.61,,,,,,,,,,,,,,,,,
warehouse hvac calculator,USD,50,0%,0%,Medium,50,,,,,,,,,,,,,,,,,,,
air conditioner ton calculator,USD,5000,0%,0%,Low,20,0.57,3.20,,,,,,,,,,,,,,,,,
ducted air conditioning kw calculator,USD,50,0%,0%,Unknown,,,,,,,,,,,,,,,,,,,,
central ac unit size calculator,USD,500,900%,0%,Low,30,0.37,3.65,,,,,,,,,,,,,,,,,
hvac cfm per square foot,USD,50,0%,0%,Low,8,,,,,,,,,,,,,,,,,,,
duct size cfm calculator,USD,500,0%,0%,Low,9,0.76,4.75,,,,,,,,,,,,,,,,,
sizing ductwork,USD,500,0%,0%,Low,17,1.14,12.50,,,,,,,,,,,,,,,,,
square footage calculator for air conditioner,USD,500,900%,0%,Low,31,0.24,1.89,,,,,,,,,,,,,,,,,
central air conditioning estimate,USD,50,0%,0%,High,88,1.25,39.18,,,,,,,,,,,,,,,,,
air conditioner size calculator for house,USD,50,0%,0%,Medium,39,0.49,2.13,,,,,,,,,,,,,,,,,
air conditioning design calculations,USD,50,0%,0%,High,86,1.26,3.67,,,,,,,,,,,,,,,,,
commercial hvac energy savings calculator,USD,50,0%,0%,Medium,43,3.78,6.35,,,,,,,,,,,,,,,,,
superheat and subcooling calculator,USD,500,0%,0%,Low,3,1.33,4.81,,,,,,,,,,,,,,,,,
hvac seer savings calculator,USD,50,0%,0%,Medium,40,,,,,,,,,,,,,,,,,,,
manual j calculation cost,USD,50,0%,0%,Medium,39,,,,,,,,,,,,,,,,,,,
central air conditioner calculator,USD,500,0%,900%,Low,8,0.50,4.09,,,,,,,,,,,,,,,,,
furnace load calculation,USD,500,0%,0%,Low,7,0.52,3.20,,,,,,,,,,,,,,,,,
hvac unit calculator,USD,50,0%,0%,Medium,50,0.89,3.14,,,,,,,,,,,,,,,,,
eer formula hvac,USD,50,0%,900%,Low,0,,,,,,,,,,,,,,,,,,,
heat loss calculation hvac,USD,50,0%,0%,High,67,0.84,5.17,,,,,,,,,,,,,,,,,
home air conditioner size calculator,USD,50,0%,0%,High,69,0.63,3.25,,,,,,,,,,,,,,,,,
heat load calc,USD,500,0%,0%,Medium,49,0.84,4.89,,,,,,,,,,,,,,,,,
free manual j,USD,50,0%,0%,Medium,56,0.90,2.84,,,,,,,,,,,,,,,,,
hvac ton size calculator,USD,50,0%,0%,Low,0,,,,,,,,,,,,,,,,,,,
hvac cooling calculator,USD,50,0%,0%,High,67,0.86,4.55,,,,,,,,,,,,,,,,,
air conditioner by square footage,USD,500,0%,0%,Medium,52,0.22,5.75,,,,,,,,,,,,,,,,,
duct calculator cfm,USD,5000,0%,0%,Low,7,1.17,4.14,,,,,,,,,,,,,,,,,
hvac load calculation training,USD,50,0%,0%,Low,29,,,,,,,,,,,,,,,,,,,
calculate ac tonnage for house,USD,50,0%,0%,Medium,36,0.37,3.97,,,,,,,,,,,,,,,,,
seer hvac calculation,USD,50,-100%,-100%,Unknown,,,,,,,,,,,,,,,,,,,,
home ac tonnage calculator,USD,50,0%,0%,Medium,36,0.37,3.97,,,,,,,,,,,,,,,,,
calculating hvac requirements,USD,50,0%,0%,Medium,40,1.05,2.91,,,,,,,,,,,,,,,,,
central ac calculator,USD,500,0%,900%,Low,8,0.50,4.09,,,,,,,,,,,,,,,,,
furnace and ac size calculator,USD,50,0%,0%,High,71,0.61,4.62,,,,,,,,,,,,,,,,,
ac replacement cost calculator,USD,500,0%,900%,Low,5,2.70,7.88,,,,,,,,,,,,,,,,,
hvac calculator btu,USD,50,0%,0%,Unknown,,,,,,,,,,,,,,,,,,,,
residential heat pump sizing,USD,50,0%,0%,High,86,,,,,,,,,,,,,,,,,,,
whole house air conditioner size calculator,USD,50,0%,0%,Medium,36,,,,,,,,,,,,,,,,,,,
energy savings seer calculator,USD,50,0%,0%,Low,8,,,,,,,,,,,,,,,,,,,
furnace replacement calculator,USD,50,0%,0%,High,86,,,,,,,,,,,,,,,,,,,
heating cooling load calculator,USD,50,0%,0%,Medium,62,1.68,5.34,,,,,,,,,,,,,,,,,
duct design calculation,USD,50,-100%,-100%,Unknown,,,,,,,,,,,,,,,,,,,,
sizing ac by square footage,USD,50,0%,-90%,Medium,46,0.29,3.91,,,,,,,,,,,,,,,,,
air conditioner house size calculator,USD,50,0%,0%,Medium,43,,,,,,,,,,,,,,,,,,,
cost to heat and cool a house calculator,USD,50,0%,-100%,Unknown,,,,,,,,,,,,,,,,,,,,
residential hvac calculator,USD,50,0%,0%,Medium,38,1.04,3.30,,,,,,,,,,,,,,,,,
easy manual j calculation,USD,50,0%,0%,High,70,1.12,10.82,,,,,,,,,,,,,,,,,
hvac size square footage,USD,50,0%,0%,Low,29,,,,,,,,,,,,,,,,,,,
cost of running central air conditioner calculator,USD,50,0%,0%,Low,0,,,,,,,,,,,,,,,,,,,
central ac btu calculator,USD,50,0%,0%,Low,19,0.59,3.20,,,,,,,,,,,,,,,,,
ems hvac load calculator,USD,50,0%,0%,Medium,41,2.43,9.80,,,,,,,,,,,,,,,,,
air conditioning room size calculator,USD,500,0%,0%,Medium,42,0.07,1.27,,,,,,,,,,,,,,,,,
hvaccalc,USD,50,0%,0%,Low,29,,,,,,,,,,,,,,,,,,,
btu calculator for hvac,USD,500,0%,0%,Low,6,0.73,6.13,,,,,,,,,,,,,,,,,
ac duct calculator,USD,50,0%,0%,Low,17,0.58,4.33,,,,,,,,,,,,,,,,,
calculate ac tons needed,USD,50,0%,0%,Medium,62,,,,,,,,,,,,,,,,,,,
air conditioning co2 calculator,USD,50,0%,0%,Low,4,,,,,,,,,,,,,,,,,,,
central air conditioner unit size calculator,USD,50,0%,0%,Medium,43,0.51,7.20,,,,,,,,,,,,,,,,,
air conditioner efficiency formula,USD,50,0%,0%,Low,16,,,,,,,,,,,,,,,,,,,
servicetitan load calculator,USD,50,0%,0%,Low,23,1.15,7.34,,,,,,,,,,,,,,,,,
central ac tonnage calculator,USD,50,0%,0%,Low,31,0.30,3.20,,,,,,,,,,,,,,,,,
formula air conditioning,USD,50,0%,0%,Low,6,,,,,,,,,,,,,,,,,,,
seer rating calculator,USD,500,0%,0%,Low,8,1.30,6.39,,,,,,,,,,,,,,,,,
3 ton ac unit btu calculator,USD,50,0%,0%,Low,29,,,,,,,,,,,,,,,,,,,
heat loads for hvac,USD,50,0%,0%,Medium,39,1.29,18.19,,,,,,,,,,,,,,,,,
air conditioner unit size calculator,USD,5000,0%,0%,Low,25,0.49,2.31,,,,,,,,,,,,,,,,,
hvac split system size calculator,USD,50,0%,0%,High,71,,,,,,,,,,,,,,,,,,,
size of ac unit needed,USD,50,0%,0%,Medium,55,0.28,5.85,,,,,,,,,,,,,,,,,
acca manual j load calculation,USD,50,900%,900%,Medium,38,1.12,4.98,,,,,,,,,,,,,,,,,
manual j cost,USD,50,0%,0%,Medium,37,2.32,11.64,,,,,,,,,,,,,,,,,
ems hvac load calculator free download,USD,50,∞,∞,Low,14,,,,,,,,,,,,,,,,,,,
central air conditioner ton calculator,USD,50,0%,0%,Medium,36,,,,,,,,,,,,,,,,,,,
furnace and ac calculator,USD,50,0%,0%,Medium,38,0.71,12.00,,,,,,,,,,,,,,,,,
sizing ac tonnage,USD,50,0%,0%,Medium,66,0.73,5.03,,,,,,,,,,,,,,,,,
air source heat pump radiator calculator,USD,50,0%,-100%,Unknown,,,,,,,,,,,,,,,,,,,,
hvac duct calculator online,USD,50,0%,0%,Low,2,,,,,,,,,,,,,,,,,,,
tons per square foot air conditioning,USD,500,0%,-90%,Medium,33,0.34,4.35,,,,,,,,,,,,,,,,,
super cool duct calculator,USD,50,0%,0%,Low,18,0.26,1.41,,,,,,,,,,,,,,,,,
hvac cooling load calculation,USD,50,0%,0%,Medium,42,0.93,4.99,,,,,,,,,,,,,,,,,
quick hvac load calculation,USD,50,0%,0%,High,86,,,,,,,,,,,,,,,,,,,
air conditioner efficiency calculator,USD,50,0%,0%,Low,12,,,,,,,,,,,,,,,,,,,
hvac cal,USD,500,-90%,0%,Low,15,3.57,25.00,,,,,,,,,,,,,,,,,
house ac tonnage calculator,USD,50,0%,0%,Medium,62,,,,,,,,,,,,,,,,,,,
btu hvac calculator,USD,500,0%,0%,Low,19,0.36,3.20,,,,,,,,,,,,,,,,,
hvac unit tonnage calculator,USD,50,0%,0%,Low,12,,,,,,,,,,,,,,,,,,,
superheat subcooling calculator,USD,500,0%,0%,Low,3,1.33,4.81,,,,,,,,,,,,,,,,,
ductless air conditioner size calculator,USD,50,-100%,-100%,Unknown,,,,,,,,,,,,,,,,,,,,
central air btu calculator,USD,50,0%,0%,High,71,,,,,,,,,,,,,,,,,,,
estimate ac tonnage,USD,5000,0%,0%,Low,20,0.57,3.20,,,,,,,,,,,,,,,,,
hvac cooling capacity calculation,USD,50,0%,0%,Low,5,,,,,,,,,,,,,,,,,,,
heating cooling calculator,USD,50,0%,0%,Low,24,0.76,3.20,,,,,,,,,,,,,,,,,
sizing heating and cooling systems calculator,USD,50,0%,0%,High,86,,,,,,,,,,,,,,,,,,,
mini split air conditioner calculator,USD,500,0%,0%,Low,23,0.34,1.26,,,,,,,,,,,,,,,,,
hvac duct sizer,USD,500,0%,0%,Low,13,0.88,8.42,,,,,,,,,,,,,,,,,
btu calculator hvac,USD,50,0%,0%,Medium,53,0.40,3.20,,,,,,,,,,,,,,,,,
duct air flow calculator,USD,50,0%,0%,Low,5,,,,,,,,,,,,,,,,,,,
home heat load calculator,USD,50,0%,0%,Medium,57,0.65,5.76,,,,,,,,,,,,,,,,,
calculate size of air conditioner for house,USD,50,0%,0%,Medium,63,0.49,4.83,,,,,,,,,,,,,,,,,
tonnage of ac per square foot,USD,500,0%,-90%,Medium,33,0.34,4.35,,,,,,,,,,,,,,,,,
size of ac needed,USD,50,0%,0%,Medium,55,0.28,5.85,,,,,,,,,,,,,,,,,
1 ton ac area calculation,USD,50,0%,0%,Unknown,,,,,,,,,,,,,,,,,,,,
1 ton ac calculation,USD,50,0%,0%,Unknown,,,,,,,,,,,,,,,,,,,,
1 ton ac per square feet,USD,50,0%,∞,Low,0,,,,,,,,,,,,,,,,,,,
a guide to hvac building services calculations,USD,50,0%,0%,Unknown,,,,,,,,,,,,,,,,,,,,
ac compressor size calculator,USD,50,0%,0%,Low,2,,,,,,,,,,,,,,,,,,,
ac compressor tonnage calculator,USD,50,0%,0%,Medium,57,,,,,,,,,,,,,,,,,,,
ac condenser size calculator,USD,50,0%,0%,Low,24,0.48,1.34,,,,,,,,,,,,,,,,,
ac cooling load calculation,USD,50,0%,0%,Low,31,0.80,3.65,,,,,,,,,,,,,,,,,
ac duct design calculator,USD,50,0%,0%,Low,17,1.25,3.00,,,,,,,,,,,,,,,,,
ac duct size calculator,USD,50,0%,0%,Low,17,1.25,3.00,,,,,,,,,,,,,,,,,
ac duct sizing calculator,USD,50,0%,0%,Low,17,1.25,3.00,,,,,,,,,,,,,,,,,
ac furnace size calculator,USD,50,0%,∞,Medium,57,,,,,,,,,,,,,,,,,,,
ac heat load calculation formula,USD,50,-100%,-100%,Unknown,,,,,,,,,,,,,,,,,,,,
ac load calculation for room,USD,50,-100%,-100%,Unknown,,,,,,,,,,,,,,,,,,,,
ac manual j calculation,USD,50,-100%,-100%,Unknown,,,,,,,,,,,,,,,,,,,,
ac room size and tonnage,USD,0,0%,0%,Unknown,,,,,,,,,,,,,,,,,,,,
ac room size ton,USD,50,0%,0%,Unknown,,,,,,,,,,,,,,,,,,,,
ac size calculator ton,USD,50,0%,0%,Medium,63,,,,,,,,,,,,,,,,,,,
ac square footage per ton,USD,500,0%,-90%,Medium,33,0.34,4.35,,,,,,,,,,,,,,,,,
ac ton according to room size,USD,50,0%,0%,Low,0,,,,,,,,,,,,,,,,,,,
ac ton and room size,USD,50,0%,0%,Low,12,,,,,,,,,,,,,,,,,,,
ac ton based on room size,USD,50,0%,-100%,Unknown,,,,,,,,,,,,,,,,,,,,
ac ton by room size,USD,50,0%,0%,High,71,,,,,,,,,,,,,,,,,,,
ac ton calculation according to room size,USD,0,0%,0%,Unknown,,,,,,,,,,,,,,,,,,,,
ac ton calculation for room,USD,50,0%,0%,Low,29,,,,,,,,,,,,,,,,,,,
ac ton calculation for room size,USD,50,0%,0%,Low,13,0.35,1.34,,,,,,,,,,,,,,,,,
ac ton calculation formula,USD,50,-100%,-100%,Unknown,,,,,,,,,,,,,,,,,,,,
ac ton capacity calculation,USD,50,0%,-100%,Unknown,,,,,,,,,,,,,,,,,,,,
ac ton for room size,USD,50,0%,0%,Low,12,,,,,,,,,,,,,,,,,,,
ac ton requirement calculator,USD,50,0%,0%,Medium,48,,,,,,,,,,,,,,,,,,,
ac ton size per sq ft,USD,50,0%,0%,Low,16,,,,,,,,,,,,,,,,,,,
ac ton with room size,USD,50,-100%,-100%,Unknown,,,,,,,,,,,,,,,,,,,,
ac tonnage and room size,USD,50,0%,0%,Medium,34,,,,,,,,,,,,,,,,,,,
ac tonnage by room size,USD,50,0%,0%,Unknown,,,,,,,,,,,,,,,,,,,,
ac tonnage calculation for room,USD,50,0%,0%,Unknown,,,,,,,,,,,,,,,,,,,,
ac tonnage calculation formula,USD,50,0%,0%,Low,25,0.60,8.45,,,,,,,,,,,,,,,,,
ac tonnage calculator commercial,USD,50,0%,0%,Low,26,1.52,4.96,,,,,,,,,,,,,,,,,
ac tonnage calculator per square meter,USD,50,0%,0%,Low,14,,,,,,,,,,,,,,,,,,,
ac tonnage for room size,USD,50,0%,0%,Low,12,0.04,4.16,,,,,,,,,,,,,,,,,
ac tonnage formula,USD,50,∞,0%,Low,0,,,,,,,,,,,,,,,,,,,
ac tonnage per square foot calculator,USD,500,0%,0%,Low,19,0.36,3.20,,,,,,,,,,,,,,,,,
ac tonnage required for a room calculation,USD,50,0%,0%,Unknown,,,,,,,,,,,,,,,,,,,,
ac tonnage requirement calculation,USD,50,-100%,-100%,Unknown,,,,,,,,,,,,,,,,,,,,
ac tonnage size,USD,50,0%,0%,Low,7,,,,,,,,,,,,,,,,,,,
ac tonnage to room size,USD,50,0%,0%,Low,12,0.04,4.16,,,,,,,,,,,,,,,,,
ac tonnage to square footage,USD,500,0%,0%,Medium,39,0.31,2.96,,,,,,,,,,,,,,,,,
ac tons for square footage,USD,500,0%,0%,Medium,39,0.31,2.96,,,,,,,,,,,,,,,,,
ac unit seer calculator,USD,50,-100%,-100%,Unknown,,,,,,,,,,,,,,,,,,,,
ac unit size calculator ton,USD,50,0%,0%,Medium,63,,,,,,,,,,,,,,,,,,,
acca manual j free,USD,50,0%,0%,Medium,46,0.93,4.45,,,,,,,,,,,,,,,,,
adi duct size calculator,USD,50,0%,0%,Low,27,,,,,,,,,,,,,,,,,,,
ahu calculation excel,USD,0,0%,0%,Unknown,,,,,,,,,,,,,,,,,,,,
ahu capacity calculation,USD,50,0%,-100%,Unknown,,,,,,,,,,,,,,,,,,,,
ahu cfm calculation,USD,50,0%,0%,Low,0,,,,,,,,,,,,,,,,,,,
ahu cfm calculation formula,USD,50,0%,-100%,Unknown,,,,,,,,,,,,,,,,,,,,
ahu cfm calculator,USD,50,0%,-100%,Unknown,,,,,,,,,,,,,,,,,,,,
ahu duct size calculation,USD,50,0%,0%,Unknown,,,,,,,,,,,,,,,,,,,,
ahu heat load calculation,USD,0,0%,0%,Unknown,,,,,,,,,,,,,,,,,,,,
ahu room size calculator,USD,50,∞,0%,High,71,,,,,,,,,,,,,,,,,,,
ahu size calculation,USD,50,-100%,0%,Unknown,,,,,,,,,,,,,,,,,,,,
ahu static pressure calculation,USD,50,0%,∞,Low,0,,,,,,,,,,,,,,,,,,,
ahu tonnage calculation,USD,50,-100%,-100%,Unknown,,,,,,,,,,,,,,,,,,,,
air conditioner based on room size,USD,50,0%,0%,High,92,0.06,1.68,,,,,,,,,,,,,,,,,
air conditioner capacity calculation,USD,500,0%,0%,Low,14,0.61,2.90,,,,,,,,,,,,,,,,,
air conditioner cfm calculator,USD,50,0%,0%,Low,14,0.90,3.23,,,,,,,,,,,,,,,,,
air conditioner condenser sizing calculator,USD,50,0%,0%,Low,24,0.48,1.34,,,,,,,,,,,,,,,,,
air conditioner cooling capacity calculation,USD,50,0%,0%,Low,31,,,,,,,,,,,,,,,,,,,
