air conditioner cost estimate,USD,50,0%,0%,High,86,,,,,,,,,,,,,,,,,,,
air conditioner estimate size,USD,5000,0%,0%,Low,25,0.49,2.31,,,,,,,,,,,,,,,,,
air conditioner heat load calculation,USD,50,0%,0%,Low,16,1.13,7.33,,,,,,,,,,,,,,,,,
air conditioner replacement cost estimate,USD,50,0%,0%,Medium,62,3.44,19.09,,,,,,,,,,,,,,,,,
air conditioner requirement calculation,USD,50,0%,0%,Low,14,,,,,,,,,,,,,,,,,,,
air conditioner seer calculator,USD,50,0%,0%,Low,13,2.79,7.43,,,,,,,,,,,,,,,,,
air conditioner square feet calculator,USD,500,900%,0%,Low,31,0.24,1.89,,,,,,,,,,,,,,,,,
air conditioner ton calculation room size,USD,50,0%,-100%,Unknown,,,,,,,,,,,,,,,,,,,,
air conditioner unit calculator,USD,5000,0%,0%,Low,18,0.49,2.55,,,,,,,,,,,,,,,,,
air conditioner unit size per square foot,USD,500,900%,0%,Medium,62,0.27,3.49,,,,,,,,,,,,,,,,,
air conditioning air flow calculation,USD,50,∞,0%,Low,14,,,,,,,,,,,,,,,,,,,
air conditioning area calculation,USD,50,0%,0%,Medium,46,,,,,,,,,,,,,,,,,,,
air conditioning calculation for a room,USD,50,0%,0%,Low,22,0.07,2.79,,,,,,,,,,,,,,,,,
air conditioning calculator excel,USD,50,-100%,-100%,Unknown,,,,,,,,,,,,,,,,,,,,
air conditioning cfm per square foot,USD,50,0%,0%,Low,19,0.30,4.60,,,,,,,,,,,,,,,,,
air conditioning contractors of america manual j load calculation,USD,50,-100%,-100%,Unknown,,,,,,,,,,,,,,,,,,,,
air conditioning cooling load calculation,USD,50,0%,0%,Low,31,0.80,3.65,,,,,,,,,,,,,,,,,
air conditioning duct calculator,USD,50,0%,0%,Low,17,0.58,4.33,,,,,,,,,,,,,,,,,
air conditioning duct design calculation,USD,50,0%,-100%,Unknown,,,,,,,,,,,,,,,,,,,,
air conditioning duct size calculator,USD,50,0%,0%,Low,17,1.25,3.00,,,,,,,,,,,,,,,,,
air conditioning horsepower calculation,USD,50,∞,0%,Low,21,,,,,,,,,,,,,,,,,,,
air conditioning load calculator online,USD,50,0%,0%,Medium,45,0.76,3.20,,,,,,,,,,,,,,,,,
air conditioning needed per square foot,USD,50,∞,0%,High,86,,,,,,,,,,,,,,,,,,,
air conditioning required per square foot,USD,50,∞,0%,High,69,0.19,3.72,,,,,,,,,,,,,,,,,
air conditioning savings calculator,USD,50,0%,0%,Low,14,,,,,,,,,,,,,,,,,,,
air conditioning space calculator,USD,50,0%,0%,Medium,43,0.37,5.50,,,,,,,,,,,,,,,,,
air conditioning ton to btu,USD,500,0%,0%,Low,16,0.13,1.65,,,,,,,,,,,,,,,,,
air conditioning tonnage calculator square feet,USD,50,∞,0%,Medium,38,,,,,,,,,,,,,,,,,,,
air conditioning units btu calculation,USD,50,0%,0%,Medium,36,,,,,,,,,,,,,,,,,,,
air duct calculator online,USD,500,0%,0%,Low,5,1.33,6.05,,,,,,,,,,,,,,,,,
air duct cfm calculator,USD,5000,0%,0%,Low,7,1.17,4.14,,,,,,,,,,,,,,,,,
air duct design calculator,USD,5000,0%,0%,Low,7,1.00,5.97,,,,,,,,,,,,,,,,,
air duct pressure drop calculation,USD,50,0%,0%,Unknown,,,,,,,,,,,,,,,,,,,,
air duct size calculator,USD,5000,0%,0%,Low,7,1.00,5.97,,,,,,,,,,,,,,,,,
air duct size calculator online,USD,500,0%,-90%,Low,10,0.87,8.26,,,,,,,,,,,,,,,,,
air ductulator,USD,50,0%,0%,High,69,,,,,,,,,,,,,,,,,,,
air flow in duct calculation,USD,50,0%,0%,Low,14,,,,,,,,,,,,,,,,,,,
air handler size calculator,USD,50,0%,0%,Low,18,,,,,,,,,,,,,,,,,,,
air handler tonnage calculator,USD,50,0%,0%,Low,7,,,,,,,,,,,,,,,,,,,
air handling unit calculation,USD,50,0%,0%,Low,31,,,,,,,,,,,,,,,,,,,
air handling unit capacity calculation,USD,50,-100%,-100%,Unknown,,,,,,,,,,,,,,,,,,,,
air handling unit design calculation,USD,50,0%,0%,Unknown,,,,,,,,,,,,,,,,,,,,
air handling unit room size,USD,50,0%,0%,Low,5,,,,,,,,,,,,,,,,,,,
air handling unit size calculation,USD,50,-100%,-100%,Unknown,,,,,,,,,,,,,,,,,,,,
airflow duct calculator,USD,50,0%,0%,Low,5,,,,,,,,,,,,,,,,,,,
area of duct calculator,USD,50,0%,0%,Low,2,,,,,,,,,,,,,,,,,,,
ashp calculator,USD,50,0%,0%,Low,0,,,,,,,,,,,,,,,,,,,
ashrae duct calculator,USD,50,0%,0%,Low,0,,,,,,,,,,,,,,,,,,,
ashrae duct size calculator,USD,50,0%,0%,Low,0,,,,,,,,,,,,,,,,,,,
basement hvac calculator,USD,50,-100%,-100%,Unknown,,,,,,,,,,,,,,,,,,,,
basic heat load calculation,USD,50,-100%,-100%,Unknown,,,,,,,,,,,,,,,,,,,,
basic hvac formulas,USD,50,0%,0%,Low,7,,,,,,,,,,,,,,,,,,,
btu calculator for central air conditioning,USD,50,0%,0%,Low,19,0.59,3.20,,,,,,,,,,,,,,,,,
btu calculator for ductless air conditioner,USD,50,0%,0%,Medium,46,0.18,1.04,,,,,,,,,,,,,,,,,
btu for room size air conditioner,USD,500,0%,0%,High,87,0.08,0.94,,,,,,,,,,,,,,,,,
btu formula for air conditioner,USD,50,0%,0%,Low,8,,,,,,,,,,,,,,,,,,,
btu formula hvac,USD,50,0%,0%,Low,7,,,,,,,,,,,,,,,,,,,
btu heat load calculator,USD,50,0%,0%,Low,32,,,,,,,,,,,,,,,,,,,
btu per square foot air conditioning,USD,500,0%,0%,Medium,51,0.13,1.40,,,,,,,,,,,,,,,,,
btu room size ac,USD,500,0%,0%,High,87,0.08,0.94,,,,,,,,,,,,,,,,,
btu size air conditioner,USD,500,900%,0%,High,88,0.10,1.62,,,,,,,,,,,,,,,,,
btu to ac tonnage calculator,USD,50,0%,0%,Low,29,0.61,2.14,,,,,,,,,,,,,,,,,
building cooling load,USD,50,0%,0%,Low,5,,,,,,,,,,,,,,,,,,,
building cooling load calculation,USD,50,0%,0%,Low,4,,,,,,,,,,,,,,,,,,,
building heat load calculation,USD,50,0%,0%,Medium,57,1.11,2.78,,,,,,,,,,,,,,,,,
calculate ac ton for room,USD,50,-100%,-100%,Unknown,,,,,,,,,,,,,,,,,,,,
calculate ac ton requirement,USD,50,∞,∞,High,71,,,,,,,,,,,,,,,,,,,
calculate ac tonnage needed,USD,50,0%,0%,Medium,62,,,,,,,,,,,,,,,,,,,
calculate air conditioner btu needed,USD,50,0%,0%,Medium,43,0.09,1.06,,,,,,,,,,,,,,,,,
calculate air conditioner cost per hour,USD,50,∞,0%,Low,0,,,,,,,,,,,,,,,,,,,
calculate airflow in ductwork,USD,50,0%,0%,Unknown,,,,,,,,,,,,,,,,,,,,
calculate cfm for air conditioning,USD,50,0%,0%,Low,0,,,,,,,,,,,,,,,,,,,
calculate cfm for room,USD,500,0%,0%,Low,11,0.08,3.18,,,,,,,,,,,,,,,,,
calculate duct area,USD,50,0%,0%,Low,2,,,,,,,,,,,,,,,,,,,
calculate duct size based on cfm,USD,50,∞,∞,Low,0,,,,,,,,,,,,,,,,,,,
calculate duct size for room,USD,50,0%,0%,Low,23,,,,,,,,,,,,,,,,,,,
calculate duct static pressure,USD,500,0%,0%,Low,4,1.50,3.40,,,,,,,,,,,,,,,,,
calculate ducted air conditioner size,USD,50,∞,∞,High,86,,,,,,,,,,,,,,,,,,,
calculate eer hvac,USD,50,0%,0%,Low,7,,,,,,,,,,,,,,,,,,,
calculate eer of air conditioner,USD,50,0%,0%,Low,0,,,,,,,,,,,,,,,,,,,
calculate heat load btu hr,USD,50,0%,-100%,Unknown,,,,,,,,,,,,,,,,,,,,
calculate heat load for a room,USD,50,0%,0%,Medium,43,0.37,2.73,,,,,,,,,,,,,,,,,
calculate heat load of a room,USD,50,∞,0%,Medium,43,,,,,,,,,,,,,,,,,,,
calculate hvac size for house,USD,50,0%,0%,High,95,0.98,7.46,,,,,,,,,,,,,,,,,
calculate return air duct size,USD,500,0%,0%,Low,7,0.91,6.64,,,,,,,,,,,,,,,,,
calculate room size for ac,USD,500,0%,0%,Medium,42,0.07,1.27,,,,,,,,,,,,,,,,,
calculate size of ac needed,USD,50,0%,0%,High,75,0.54,3.18,,,,,,,,,,,,,,,,,
calculate size of ac unit needed,USD,50,0%,0%,High,75,0.54,3.18,,,,,,,,,,,,,,,,,
calculate size of air conditioner needed,USD,50,0%,0%,Medium,64,,,,,,,,,,,,,,,,,,,
calculate size of central air conditioner needed,USD,0,0%,-100%,Unknown,,,,,,,,,,,,,,,,,,,,
calculate weight of ductwork,USD,50,0%,0%,Low,0,,,,,,,,,,,,,,,,,,,
calculating ac tonnage required,USD,50,0%,0%,Medium,62,,,,,,,,,,,,,,,,,,,
calculating cfm for ductwork,USD,50,0%,0%,Low,11,,,,,,,,,,,,,,,,,,,
calculating ductwork size,USD,5000,0%,0%,Low,7,1.00,5.97,,,,,,,,,,,,,,,,,
calculating heat load for a house,USD,50,0%,0%,Medium,57,0.56,1.85,,,,,,,,,,,,,,,,,
calculating static pressure in ductwork,USD,500,0%,0%,Low,4,1.50,3.40,,,,,,,,,,,,,,,,,
calculation for air conditioner for room,USD,50,0%,0%,Low,29,,,,,,,,,,,,,,,,,,,
calculation of heat load in air conditioning,USD,50,0%,0%,Unknown,,,,,,,,,,,,,,,,,,,,
calculator ducting,USD,50,-100%,0%,Unknown,,,,,,,,,,,,,,,,,,,,
carrier duct calculator,USD,50,0%,0%,Low,22,,,,,,,,,,,,,,,,,,,
central ac btu per square foot,USD,50,∞,0%,Low,29,,,,,,,,,,,,,,,,,,,
central ac capacity calculator,USD,50,0%,-100%,Unknown,,,,,,,,,,,,,,,,,,,,
central ac load calculation,USD,50,∞,0%,Low,10,,,,,,,,,,,,,,,,,,,
central ac unit btu calculator,USD,50,0%,0%,Low,14,,,,,,,,,,,,,,,,,,,
central ac unit calculator,USD,500,0%,900%,Low,8,0.50,4.09,,,,,,,,,,,,,,,,,
central air and furnace installation cost calculator,USD,50,0%,0%,High,86,,,,,,,,,,,,,,,,,,,
central air btu per square foot,USD,50,0%,0%,High,71,,,,,,,,,,,,,,,,,,,
central air conditioner seer calculator,USD,50,∞,0%,Low,29,,,,,,,,,,,,,,,,,,,
central air conditioner size per square foot,USD,50,0%,-100%,Unknown,,,,,,,,,,,,,,,,,,,,
central air conditioner square footage calculator,USD,50,0%,0%,Low,14,,,,,,,,,,,,,,,,,,,
central air conditioner wattage calculator,USD,50,∞,0%,Low,0,,,,,,,,,,,,,,,,,,,
central air size for square footage,USD,50,∞,∞,High,71,,,,,,,,,,,,,,,,,,,
central air size per square foot,USD,50,∞,0%,Medium,50,,,,,,,,,,,,,,,,,,,
central air square footage calculator,USD,50,0%,-100%,Unknown,,,,,,,,,,,,,,,,,,,,
central air ton calculator,USD,50,0%,0%,High,86,,,,,,,,,,,,,,,,,,,
central air tonnage calculator,USD,50,0%,0%,Medium,43,0.33,4.71,,,,,,,,,,,,,,,,,
central air unit calculator,USD,50,∞,0%,Low,25,,,,,,,,,,,,,,,,,,,
central heat and air calculator,USD,50,-100%,-100%,Unknown,,,,,,,,,,,,,,,,,,,,
central heat and air sizing calculator,USD,50,0%,-100%,Unknown,,,,,,,,,,,,,,,,,,,,
cfm calculation in ahu,USD,0,0%,0%,Unknown,,,,,,,,,,,,,,,,,,,,
cfm formula for hvac,USD,50,0%,0%,Low,6,0.81,4.46,,,,,,,,,,,,,,,,,
cfm formula in hvac,USD,50,0%,0%,Low,0,,,,,,,,,,,,,,,,,,,
cfm formula of ahu,USD,0,0%,0%,Unknown,,,,,,,,,,,,,,,,,,,,
cfm heat load calculation,USD,50,0%,0%,Medium,43,,,,,,,,,,,,,,,,,,,
cfm hvac formula,USD,50,0%,0%,Low,6,0.81,4.46,,,,,,,,,,,,,,,,,
cfm per square foot hvac,USD,50,0%,0%,Low,9,,,,,,,,,,,,,,,,,,,
cold room cooling load calculation,USD,50,0%,∞,Low,0,,,,,,,,,,,,,,,,,,,
cold room heat load calculation,USD,50,∞,0%,High,71,,,,,,,,,,,,,,,,,,,
commercial air conditioner size calculator,USD,50,0%,0%,Low,14,,,,,,,,,,,,,,,,,,,
commercial air conditioning calculator,USD,50,0%,0%,Medium,57,1.27,8.71,,,,,,,,,,,,,,,,,
commercial cooling load calculator,USD,50,0%,0%,Medium,54,0.73,2.69,,,,,,,,,,,,,,,,,
commercial kitchen cooling load calculation,USD,50,0%,∞,Low,18,,,,,,,,,,,,,,,,,,,
common hvac formulas,USD,50,0%,0%,Low,5,,,,,,,,,,,,,,,,,,,
compression ratio calculator hvac,USD,50,0%,0%,Low,4,,,,,,,,,,,,,,,,,,,
compression ratio formula hvac,USD,50,0%,0%,Low,0,,,,,,,,,,,,,,,,,,,
cooling and heating load,USD,50,0%,0%,Low,15,,,,,,,,,,,,,,,,,,,
cooling and heating load calculation manual,USD,50,0%,0%,Medium,39,,,,,,,,,,,,,,,,,,,
cooling capacity calculation for air conditioner,USD,50,-100%,-100%,Unknown,,,,,,,,,,,,,,,,,,,,
cooling coil load calculation,USD,50,-100%,-100%,Unknown,,,,,,,,,,,,,,,,,,,,
cooling load,USD,50,0%,-90%,Low,2,,,,,,,,,,,,,,,,,,,
cooling load and heating load,USD,50,0%,∞,Low,14,,,,,,,,,,,,,,,,,,,
cooling load calculation excel,USD,50,0%,0%,Low,0,,,,,,,,,,,,,,,,,,,
cooling load calculation for room,USD,50,0%,0%,Low,7,,,,,,,,,,,,,,,,,,,
cooling load calculation formula,USD,50,0%,0%,Low,4,,,,,,,,,,,,,,,,,,,
cooling load calculation in hvac systems,USD,0,0%,0%,Unknown,,,,,,,,,,,,,,,,,,,,
cooling load calculation online,USD,50,∞,0%,Medium,39,,,,,,,,,,,,,,,,,,,
cooling load for air conditioning,USD,50,0%,0%,Low,2,,,,,,,,,,,,,,,,,,,
cooling load formula,USD,50,0%,0%,Low,3,,,,,,,,,,,,,,,,,,,
cooling load per square foot,USD,50,0%,0%,Low,6,,,,,,,,,,,,,,,,,,,
cooling tower heat load calculation,USD,50,-100%,-100%,Unknown,,,,,,,,,,,,,,,,,,,,
cooling tower heat load calculation formula,USD,0,0%,0%,Unknown,,,,,,,,,,,,,,,,,,,,
cost savings seer calculator,USD,50,0%,0%,Low,21,,,,,,,,,,,,,,,,,,,
cubic feet air conditioner,USD,50,0%,-100%,Unknown,,,,,,,,,,,,,,,,,,,,
daikin duct sizer,USD,50,0%,0%,Low,8,,,,,,,,,,,,,,,,,,,
data center hvac calculator,USD,50,0%,-100%,Unknown,,,,,,,,,,,,,,,,,,,,
delta t formula hvac,USD,50,0%,0%,Low,2,,,,,,,,,,,,,,,,,,,
design heat load,USD,50,0%,0%,Low,24,,,,,,,,,,,,,,,,,,,
determining ac tonnage,USD,5000,0%,0%,Low,20,0.57,3.20,,,,,,,,,,,,,,,,,
determining air conditioner size,USD,5000,0%,0%,Low,25,0.49,2.31,,,,,,,,,,,,,,,,,
determining size of ac unit,USD,50,0%,0%,Medium,35,0.49,8.74,,,,,,,,,,,,,,,,,
determining tonnage of ac units,USD,50,0%,0%,Low,14,,,,,,,,,,,,,,,,,,,
download duct sizer,USD,50,0%,0%,Low,14,,,,,,,,,,,,,,,,,,,
duct area calculator excel,USD,50,-100%,-100%,Unknown,,,,,,,,,,,,,,,,,,,,
duct aspect ratio calculator,USD,50,0%,0%,Low,0,,,,,,,,,,,,,,,,,,,
duct board calculator,USD,50,0%,0%,Low,8,,,,,,,,,,,,,,,,,,,
duct calculator excel,USD,50,0%,-100%,Unknown,,,,,,,,,,,,,,,,,,,,
duct calculator free,USD,50,0%,0%,Low,29,,,,,,,,,,,,,,,,,,,
duct calculator hvac,USD,500,0%,900%,Low,7,0.66,4.93,,,,,,,,,,,,,,,,,
duct cost calculator,USD,50,0%,0%,Low,33,,,,,,,,,,,,,,,,,,,
duct diameter calculator,USD,50,0%,0%,Low,14,0.60,3.00,,,,,,,,,,,,,,,,,
duct equivalent size calculator,USD,50,0%,0%,Low,2,,,,,,,,,,,,,,,,,,,
duct external static pressure calculation,USD,50,-100%,-100%,Unknown,,,,,,,,,,,,,,,,,,,,
duct fitting calculator,USD,50,0%,0%,Low,10,,,,,,,,,,,,,,,,,,,
duct fitting equivalent length calculator,USD,50,0%,0%,Low,0,,,,,,,,,,,,,,,,,,,
duct fitting loss calculator,USD,50,0%,0%,Low,8,,,,,,,,,,,,,,,,,,,
duct friction calculator,USD,50,0%,0%,Low,0,,,,,,,,,,,,,,,,,,,
duct heat gain calculation,USD,50,0%,0%,Low,29,,,,,,,,,,,,,,,,,,,
duct insulation calculation formula,USD,50,∞,∞,Low,14,,,,,,,,,,,,,,,,,,,
duct length calculator,USD,50,0%,0%,Low,3,,,,,,,,,,,,,,,,,,,
duct measurement calculator,USD,50,0%,0%,Low,0,,,,,,,,,,,,,,,,,,,
duct offset calculator,USD,500,-90%,-90%,Low,5,0.86,3.00,,,,,,,,,,,,,,,,,
duct plenum size calculator,USD,50,0%,0%,Low,0,,,,,,,,,,,,,,,,,,,
duct pressure calculator,USD,50,0%,0%,Low,0,,,,,,,,,,,,,,,,,,,
duct quantity calculation,USD,50,0%,0%,Unknown,,,,,,,,,,,,,,,,,,,,
duct reducer area calculation,USD,0,0%,0%,Unknown,,,,,,,,,,,,,,,,,,,,
duct size calculation for hvac,USD,50,0%,∞,Medium,57,,,,,,,,,,,,,,,,,,,
duct size calculator mcquay,USD,50,0%,0%,Medium,36,,,,,,,,,,,,,,,,,,,
duct size to cfm calculator,USD,500,0%,0%,Low,9,0.76,4.75,,,,,,,,,,,,,,,,,
duct sizer download free,USD,50,0%,0%,Unknown,,,,,,,,,,,,,,,,,,,,
duct sizer mcquay online,USD,50,0%,-100%,Unknown,,,,,,,,,,,,,,,,,,,,
duct sizing duct calculation,USD,50,∞,0%,Low,14,,,,,,,,,,,,,,,,,,,
duct square feet calculation formula,USD,50,0%,0%,Low,8,,,,,,,,,,,,,,,,,,,
duct square meter calculation,USD,0,0%,0%,Unknown,,,,,,,,,,,,,,,,,,,,
duct square meter calculator,USD,50,∞,∞,Low,14,,,,,,,,,,,,,,,,,,,
duct surface area calculator,USD,50,0%,0%,Low,1,,,,,,,,,,,,,,,,,,,
duct system calculator,USD,50,0%,0%,Low,22,,,,,,,,,,,,,,,,,,,
duct thickness calculation,USD,50,0%,-100%,Unknown,,,,,,,,,,,,,,,,,,,,
duct u lator,USD,5000,0%,0%,Low,19,0.67,4.40,,,,,,,,,,,,,,,,,
duct volume calculator,USD,50,0%,0%,Low,4,,,,,,,,,,,,,,,,,,,
duct weight calculation,USD,50,0%,0%,Low,3,,,,,,,,,,,,,,,,,,,
duct wheel calculator,USD,50,-100%,-100%,Unknown,,,,,,,,,,,,,,,,,,,,
ducted air conditioning sizing,USD,50,∞,∞,Medium,43,,,,,,,,,,,,,,,,,,,
ducting calculation formula,USD,50,0%,0%,Low,14,,,,,,,,,,,,,,,,,,,
ducting square meter calculation,USD,0,0%,0%,Unknown,,,,,,,,,,,,,,,,,,,,
ducting weight calculator,USD,50,0%,0%,Low,3,,,,,,,,,,,,,,,,,,,
ductless air conditioner calculator,USD,50,∞,0%,Medium,43,,,,,,,,,,,,,,,,,,,
ductulator calculator,USD,500,900%,900%,Low,8,0.76,3.86,,,,,,,,,,,,,,,,,
ductulator excel,USD,50,∞,0%,Low,5,,,,,,,,,,,,,,,,,,,
ductulator free download,USD,50,∞,0%,High,86,,,,,,,,,,,,,,,,,,,
ductulator mcquay,USD,50,0%,0%,Low,25,,,,,,,,,,,,,,,,,,,
ductwork air flow calculator,USD,50,0%,0%,Low,5,,,,,,,,,,,,,,,,,,,
ductwork airflow calculator,USD,50,0%,0%,Low,8,0.48,3.00,,,,,,,,,,,,,,,,,
ductwork calculator cfm,USD,5000,0%,0%,Low,7,1.17,4.14,,,,,,,,,,,,,,,,,
ductwork calculator online,USD,500,0%,0%,Low,5,1.33,6.05,,,,,,,,,,,,,,,,,
ductwork formulas,USD,50,0%,0%,Low,7,,,,,,,,,,,,,,,,,,,
ductwork pressure drop calculator,USD,50,0%,-90%,Low,2,,,,,,,,,,,,,,,,,,,
ductwork pricing calculator,USD,50,0%,0%,High,79,2.03,5.37,,,,,,,,,,,,,,,,,
ductwork size calculator,USD,5000,0%,0%,Low,7,1.00,5.97,,,,,,,,,,,,,,,,,
ductwork sizing calculation and design for efficiency,USD,50,0%,0%,Unknown,,,,,,,,,,,,,,,,,,,,
ductwork weight calculator,USD,50,0%,0%,Low,3,,,,,,,,,,,,,,,,,,,
e20 heat load calculation,USD,50,-100%,-100%,Unknown,,,,,,,,,,,,,,,,,,,,
e20 heat load calculation excel,USD,0,0%,0%,Unknown,,,,,,,,,,,,,,,,,,,,
easy heat load calculator,USD,50,0%,0%,Medium,61,2.51,7.37,,,,,,,,,,,,,,,,,
easy hvac load calculation,USD,50,0%,0%,High,76,2.13,15.52,,,,,,,,,,,,,,,,,
eer formula air conditioning,USD,50,0%,0%,Unknown,,,,,,,,,,,,,,,,,,,,
elite duct sizer,USD,50,0%,∞,Low,0,,,,,,,,,,,,,,,,,,,
energy star hvac calculator,USD,50,∞,∞,Low,1,,,,,,,,,,,,,,,,,,,
equipment heat load calculator,USD,50,0%,0%,Low,29,,,,,,,,,,,,,,,,,,,
esp calculation hvac,USD,50,0%,0%,Low,0,,,,,,,,,,,,,,,,,,,
esp calculation in hvac,USD,50,0%,0%,Low,0,,,,,,,,,,,,,,,,,,,
estimate cooling load,USD,500,0%,0%,Low,32,0.45,3.20,,,,,,,,,,,,,,,,,
estimate hvac installation costs,USD,50,0%,900%,High,70,2.22,13.40,,,,,,,,,,,,,,,,,
estimating for hvac,USD,500,0%,0%,High,76,13.26,67.01,,,,,,,,,,,,,,,,,
exhaust duct calculator,USD,50,-100%,-100%,Unknown,,,,,,,,,,,,,,,,,,,,
figuring ac tonnage,USD,5000,0%,0%,Low,20,0.57,3.20,,,,,,,,,,,,,,,,,
find ac tonnage,USD,50,0%,0%,Low,14,,,,,,,,,,,,,,,,,,,
find tonnage of ac,USD,50,0%,0%,Low,4,,,,,,,,,,,,,,,,,,,
flex duct calculator,USD,500,0%,0%,Low,2,0.73,3.13,,,,,,,,,,,,,,,,,
flex duct calculator online,USD,50,0%,0%,Low,4,,,,,,,,,,,,,,,,,,,
flexible duct calculator,USD,500,0%,0%,Low,2,0.73,3.13,,,,,,,,,,,,,,,,,
forced air furnace duct size calculation,USD,50,-100%,-100%,Unknown,,,,,,,,,,,,,,,,,,,,
formula for ac tonnage calculation,USD,50,0%,0%,Low,25,0.60,8.45,,,,,,,,,,,,,,,,,
formula for air conditioner size,USD,50,0%,0%,Medium,35,0.49,8.74,,,,,,,,,,,,,,,,,
free hvac calculator,USD,500,0%,0%,Medium,54,0.96,4.20,,,,,,,,,,,,,,,,,
free online ductulator,USD,50,900%,900%,Low,1,,,,,,,,,,,,,,,,,,,
free online hvac load calculator,USD,50,0%,0%,Medium,62,1.16,4.49,,,,,,,,,,,,,,,,,
free online manual j calculator,USD,50,0%,0%,Medium,61,1.11,4.36,,,,,,,,,,,,,,,,,
free online manual j load calculation,USD,50,0%,0%,Medium,48,0.97,1.90,,,,,,,,,,,,,,,,,
free residential hvac load calculation,USD,50,0%,-100%,Unknown,,,,,,,,,,,,,,,,,,,,
fresh air calculation in hvac,USD,50,0%,0%,Low,0,,,,,,,,,,,,,,,,,,,
fresh air cooling load calculation,USD,50,0%,-100%,Unknown,,,,,,,,,,,,,,,,,,,,
fresh air handling unit calculations,USD,0,0%,0%,Unknown,,,,,,,,,,,,,,,,,,,,
fresh air hvac sizing,USD,50,0%,0%,Low,2,,,,,,,,,,,,,,,,,,,
fresh air load calculation,USD,50,-100%,0%,Unknown,,,,,,,,,,,,,,,,,,,,
furnace ac size calculator,USD,50,0%,0%,Medium,34,0.27,2.30,,,,,,,,,,,,,,,,,
furnace duct size calculator,USD,50,0%,0%,Low,0,,,,,,,,,,,,,,,,,,,
furnace ductwork sizing,USD,50,0%,0%,Low,24,,,,,,,,,,,,,,,,,,,
furnace heat load calculation,USD,50,0%,∞,Medium,57,,,,,,,,,,,,,,,,,,,
furnace temperature rise calculation,USD,50,0%,0%,Low,0,,,,,,,,,,,,,,,,,,,
furnace ton calculator,USD,50,0%,0%,High,71,,,,,,,,,,,,,,,,,,,
geothermal heating and cooling calculator,USD,50,∞,0%,Low,0,,,,,,,,,,,,,,,,,,,
geothermal heating cost calculator,USD,50,0%,0%,Low,0,,,,,,,,,,,,,,,,,,,
gpm calculation in hvac,USD,50,0%,∞,Low,0,,,,,,,,,,,,,,,,,,,
gpm formula hvac,USD,50,0%,0%,Low,0,,,,,,,,,,,,,,,,,,,
gpm formula in hvac,USD,50,0%,-100%,Unknown,,,,,,,,,,,,,,,,,,,,
heat and cooling load calculations,USD,500,0%,0%,Medium,53,1.19,5.72,,,,,,,,,,,,,,,,,
heat calculation in hvac,USD,50,0%,∞,Medium,57,1.70,4.68,,,,,,,,,,,,,,,,,
heat duct calculator,USD,50,0%,0%,Low,0,,,,,,,,,,,,,,,,,,,
heat load and cooling load calculations,USD,50,0%,0%,High,69,1.16,4.75,,,,,,,,,,,,,,,,,
heat load calculation commercial building,USD,50,0%,0%,High,86,,,,,,,,,,,,,,,,,,,
heat load calculation for air conditioning excel,USD,50,0%,0%,Unknown,,,,,,,,,,,,,,,,,,,,
heat load calculation for hvac system,USD,50,0%,0%,Low,5,,,,,,,,,,,,,,,,,,,
heat load calculation for room,USD,50,0%,0%,Medium,43,0.37,2.73,,,,,,,,,,,,,,,,,
heat load calculation formula for air conditioning,USD,50,0%,-100%,Unknown,,,,,,,,,,,,,,,,,,,,
heat load calculation formula for hvac design,USD,50,0%,-100%,Unknown,,,,,,,,,,,,,,,,,,,,
heat load calculation formula in hvac,USD,50,0%,0%,Low,5,,,,,,,,,,,,,,,,,,,
heat load calculation of a room,USD,0,0%,0%,Unknown,,,,,,,,,,,,,,,,,,,,
heat load calculation of heat exchanger,USD,0,0%,0%,Unknown,,,,,,,,,,,,,,,,,,,,
heat load formula,USD,50,0%,0%,Low,6,,,,,,,,,,,,,,,,,,,
heat load formula hvac,USD,50,0%,0%,Low,14,,,,,,,,,,,,,,,,,,,
heat loss heat gain calculations,USD,50,0%,0%,Low,33,0.84,6.17,,,,,,,,,,,,,,,,,
heat loss load calculator,USD,50,0%,0%,Low,29,,,,,,,,,,,,,,,,,,,
heat pump ductwork sizing,USD,50,0%,0%,Low,4,,,,,,,,,,,,,,,,,,,
heat pump seer rating calculator,USD,50,0%,0%,Low,24,,,,,,,,,,,,,,,,,,,
heating and air conditioning calculator,USD,50,∞,0%,Medium,57,,,,,,,,,,,,,,,,,,,
heating and air conditioning size calculator,USD,50,0%,0%,Medium,57,,,,,,,,,,,,,,,,,,,
heating and cooling btu calculator,USD,500,0%,0%,Low,19,0.36,3.20,,,,,,,,,,,,,,,,,
heating and cooling calculator size,USD,5000,900%,900%,Low,16,0.64,3.71,,,,,,,,,,,,,,,,,
heating and cooling capacity calculator,USD,50,0%,∞,Medium,50,,,,,,,,,,,,,,,,,,,
heating and cooling square footage calculator,USD,50,0%,∞,Medium,46,0.25,1.57,,,,,,,,,,,,,,,,,
heating duct size calculator,USD,50,0%,∞,Low,17,,,,,,,,,,,,,,,,,,,
heating load and cooling load,USD,50,0%,0%,Low,15,,,,,,,,,,,,,,,,,,,
home ac estimate,USD,50,0%,0%,High,97,12.22,62.14,,,,,,,,,,,,,,,,,
home air conditioner calculator,USD,50,0%,0%,Medium,62,0.46,2.53,,,,,,,,,,,,,,,,,
home air conditioning cost calculator,USD,50,0%,-100%,Unknown,,,,,,,,,,,,,,,,,,,,
home central air conditioner size calculator,USD,50,-100%,-100%,Unknown,,,,,,,,,,,,,,,,,,,,
home hvac calculator,USD,50,0%,0%,High,75,0.46,5.23,,,,,,,,,,,,,,,,,
home hvac size calculator,USD,50,0%,0%,Medium,48,0.35,7.40,,,,,,,,,,,,,,,,,
hvac area calculation,USD,50,-100%,-100%,Unknown,,,,,,,,,,,,,,,,,,,,
hvac basic formulas,USD,50,0%,0%,Low,7,,,,,,,,,,,,,,,,,,,
hvac btu calculation formula,USD,50,0%,-100%,Unknown,,,,,,,,,,,,,,,,,,,,
hvac btu formula,USD,50,0%,0%,Low,7,,,,,,,,,,,,,,,,,,,
hvac btu sizing,USD,50,-100%,0%,Unknown,,,,,,,,,,,,,,,,,,,,
hvac btu to ton conversion,USD,50,0%,0%,Low,25,,,,,,,,,,,,,,,,,,,
hvac building services calculations,USD,50,0%,0%,Unknown,,,,,,,,,,,,,,,,,,,,
hvac calc residential,USD,50,0%,0%,High,71,1.91,8.69,,,,,,,,,,,,,,,,,
hvac calculation excel,USD,50,0%,0%,Low,0,,,,,,,,,,,,,,,,,,,
hvac calculation for buildings,USD,50,0%,0%,Unknown,,,,,,,,,,,,,,,,,,,,
hvac calculations and duct sizing,USD,50,0%,0%,High,86,2.43,11.69,,,,,,,,,,,,,,,,,
hvac capacity formula,USD,50,0%,0%,Low,0,,,,,,,,,,,,,,,,,,,
hvac charging calculator,USD,50,0%,0%,Low,14,,,,,,,,,,,,,,,,,,,
hvac condensate calculator,USD,50,0%,0%,Low,3,,,,,,,,,,,,,,,,,,,
hvac conversion calculator,USD,50,0%,0%,Medium,38,0.46,3.91,,,,,,,,,,,,,,,,,
hvac conversion formulas,USD,50,-100%,-100%,Unknown,,,,,,,,,,,,,,,,,,,,
hvac cooling load,USD,50,0%,0%,Low,21,,,,,,,,,,,,,,,,,,,
hvac duct air flow calculation,USD,50,0%,0%,Medium,46,,,,,,,,,,,,,,,,,,,
hvac duct area calculation formula,USD,50,0%,0%,Low,0,,,,,,,,,,,,,,,,,,,
hvac duct calculation formula,USD,50,0%,0%,Low,7,,,,,,,,,,,,,,,,,,,
hvac duct cfm calculator,USD,50,0%,0%,Low,17,1.10,6.72,,,,,,,,,,,,,,,,,
hvac duct design calculator,USD,500,0%,-90%,Low,3,1.37,10.44,,,,,,,,,,,,,,,,,
hvac duct measurement,USD,50,0%,0%,Medium,43,,,,,,,,,,,,,,,,,,,
hvac duct measurement formula,USD,50,0%,0%,Low,0,,,,,,,,,,,,,,,,,,,
hvac duct reducer calculation,USD,50,0%,0%,Low,5,,,,,,,,,,,,,,,,,,,
hvac duct size calculation formula,USD,50,-100%,0%,Unknown,,,,,,,,,,,,,,,,,,,,
hvac duct size calculator excel,USD,50,-100%,-100%,Unknown,,,,,,,,,,,,,,,,,,,,
hvac duct size calculator free download,USD,50,0%,0%,Unknown,,,,,,,,,,,,,,,,,,,,
hvac duct static pressure calculation,USD,50,0%,0%,Low,11,,,,,,,,,,,,,,,,,,,
hvac duct weight calculator,USD,50,0%,0%,Low,1,,,,,,,,,,,,,,,,,,,
hvac duct weight calculator excel,USD,50,0%,∞,Low,0,,,,,,,,,,,,,,,,,,,
hvac ductwork sizing,USD,500,0%,0%,Low,13,0.88,8.42,,,,,,,,,,,,,,,,,
hvac ductwork weight calculator,USD,50,0%,0%,Low,1,,,,,,,,,,,,,,,,,,,
hvac energy consumption calculator,USD,50,0%,-100%,Unknown,,,,,,,,,,,,,,,,,,,,
hvac energy cost calculator,USD,50,0%,0%,Low,14,,,,,,,,,,,,,,,,,,,
hvac energy efficiency calculator,USD,50,-100%,-100%,Unknown,,,,,,,,,,,,,,,,,,,,
hvac engineering calculations,USD,50,∞,0%,Medium,57,,,,,,,,,,,,,,,,,,,
hvac engineering formulas,USD,50,-100%,0%,Unknown,,,,,,,,,,,,,,,,,,,,
hvac enthalpy formula,USD,50,0%,0%,Low,7,,,,,,,,,,,,,,,,,,,
hvac equations,USD,50,0%,0%,Low,5,,,,,,,,,,,,,,,,,,,
hvac formulas excel,USD,0,0%,0%,Unknown,,,,,,,,,,,,,,,,,,,,
hvac heat load calculation online,USD,50,∞,0%,High,86,,,,,,,,,,,,,,,,,,,
hvac heat loss,USD,50,0%,∞,Medium,62,,,,,,,,,,,,,,,,,,,
hvac heating and cooling load calculations,USD,50,-100%,-100%,Unknown,,,,,,,,,,,,,,,,,,,,
hvac how many cfm per square foot,USD,50,0%,0%,Low,0,,,,,,,,,,,,,,,,,,,
hvac how many tons do i need,USD,50,0%,0%,High,79,0.42,4.78,,,,,,,,,,,,,,,,,
hvac how many tons per square foot,USD,500,0%,0%,Low,18,0.28,4.23,,,,,,,,,,,,,,,,,
hvac kwh calculator,USD,500,-90%,0%,Low,19,,,,,,,,,,,,,,,,,,,
hvac load analysis,USD,50,0%,0%,Medium,50,,,,,,,,,,,,,,,,,,,
hvac load calculation excel,USD,50,0%,0%,Low,18,,,,,,,,,,,,,,,,,,,
hvac load calculation for basement,USD,50,0%,0%,Low,11,,,,,,,,,,,,,,,,,,,
hvac load calculation online,USD,50,0%,0%,Medium,35,1.72,13.74,,,,,,,,,,,,,,,,,
hvac manual d calculation,USD,50,0%,0%,Medium,52,2.40,26.76,,,,,,,,,,,,,,,,,
hvac manual j calculator,USD,50,0%,0%,Medium,44,0.91,6.13,,,,,,,,,,,,,,,,,
hvac manual j free download,USD,50,∞,0%,Low,14,,,,,,,,,,,,,,,,,,,
hvac manual j online,USD,50,0%,0%,Unknown,,,,,,,,,,,,,,,,,,,,
hvac math formulas,USD,50,0%,0%,Low,6,1.92,16.62,,,,,,,,,,,,,,,,,
hvac parts markup calculator,USD,50,0%,0%,Low,15,,,,,,,,,,,,,,,,,,,
